,ID,Sentence,URL,Sentiment,translated
705,647,また、当社は、2019年10月に開催された第46回東京モーターショーにおいて、新世代商品の第３弾となるマツダ初の量産EV「MAZDAMX-30（エムエックスサーティー)」を世界初公開しました。,https://disclosure2dl.edinet-fsa.go.jp/searchdocument/pdf/S100IS9D.pdf,Positive,"In addition, at the 46th Tokyo Motor Show held in October 2019, the Company will unveil the world's first Mazda's first mass-produced EV ""MAZDAMX-30 (MAZDAMX-30)"". did."
706,653,さらに、人間中心の開発思想に基づき、EVでも変わることのない「人馬一体による走る歓び」を追求するため、新たに電動化技術「e-SKYACTIV（イー・スカイアクティブ）」を採用し、意のままの操作感と滑らかな車両挙動を高次元に融合させ、ドライバーが自然に運転を楽しむことができる走りを実現しました。,https://disclosure2dl.edinet-fsa.go.jp/searchdocument/pdf/S100IS9D.pdf,Positive,"Furthermore, based on human-centered development philosophy, in order to pursue a ""joy of running by human horses"" that does not change in EVs, a new electrification technology ""e-Skyactiv"" will be adopted, and it is intended. The operation of the operation and the smooth vehicle behavior are fused in a high dimension, realizing a running where drivers can enjoy driving naturally."
707,655,「オフロード・トラクション・アシスト」は、悪路における想定外のスタック時にも、AWDとトラクション・コントロール・システムの協調によって接地輪への駆動力伝達を最大化して、悪路からのスムーズな脱出を実現し、さまざまな路面環境において安心・安全の走行性能を提供します。,https://disclosure2dl.edinet-fsa.go.jp/searchdocument/pdf/S100IS9D.pdf,Positive,"""Off -Road Traction Assist"" has a smooth escape from the evil road, maximizing the driving force transmission to the ground wheels by coordinating the AWD and traction control systems during unexpected stacks on bad roads. It is realized and provides safe and secure driving performance in various road surface environments."
708,658,当社は、株主をはじめお客さま、お取引先、地域社会、従業員等のステークホルダーと良好な関係を構築しつつ、透明・公正かつ迅速・果断な意思決定を行うことにより、当社の持続的成長及び中長期的な企業価値の向上を目指し、以下の基本的な考え方に沿ってコーポレート・ガバナンスの充実に継続的に取り組みます。,https://disclosure2dl.edinet-fsa.go.jp/searchdocument/pdf/S100IS9D.pdf,Positive,"The Company has a stakeholder of shareholders, business partners, local communities, employees, and other stakeholders, and make a sustainable growth of our company by making a transparent, fair, quick and compelling decision. And, with the aim of improving the medium- to long -term corporate value, we will continue to continue to enhance corporate governance according to the following basic ideas."
709,659,当社は、株主の権利が実質的に確保され、適切に行使されるよう環境を整備するとともに、株主の実質的平等性を確保します。,https://disclosure2dl.edinet-fsa.go.jp/searchdocument/pdf/S100IS9D.pdf,Positive,"The Company will create an environment in which shareholders' rights are substantially secured and appropriately exercised, and the substantial equality of shareholders is secured."
710,660,当社は、ステークホルダーの権利・立場や健全な事業活動倫理を尊重する企業文化・風土を醸成し、ステークホルダーと適切に対話・協働します。,https://disclosure2dl.edinet-fsa.go.jp/searchdocument/pdf/S100IS9D.pdf,Positive,"We foster corporate culture and climate that respects stakeholders' rights, positions, and healthy business activity ethics, and properly interact with stakeholders."
711,661,当社は、会社の情報について法令に基づき適切に開示するとともに、法令に基づく開示以外の情報提供についても、公平性に配慮し、主体的に取り組みます。,https://disclosure2dl.edinet-fsa.go.jp/searchdocument/pdf/S100IS9D.pdf,Positive,"The Company will appropriately disclose the company information based on laws and regulations, and will also provide information other than disclosure based on laws and regulations, considering fairness in consideration of fairness."
712,662,当社取締役会は、株主に対する受託者責任・説明責任を踏まえ、企業戦略等の大きな方向性を示すとともに、適切なリスクテイクを支える環境整備を行い、独立した客観的な立場から経営陣に対する実効性の高い監督を行います。,https://disclosure2dl.edinet-fsa.go.jp/searchdocument/pdf/S100IS9D.pdf,Positive,"The Board of Directors, based on the responsibility and accountability of shareholders, shows a large direction such as corporate strategies, and develops an environment that supports appropriate risk take, and is effective against management from an independent objective standpoint. We will do a high director."
713,663,当社は、株主と建設的な対話を行い、株主の関心・懸念に正当な関心をもつとともに、当社の経営方針を分かりやすい形で説明し理解を得るよう努めます。,https://disclosure2dl.edinet-fsa.go.jp/searchdocument/pdf/S100IS9D.pdf,Positive,"We will have a constructive dialogue with shareholders, have a legitimate interest in shareholders' interests and concerns, and strive to explain our management policies in an easy -to -understand manner."
714,664,企業統治の体制の概要とその体制を採用する理由当社を取り巻く事業環境が急速に変化する中、経営に関する意思決定の更なる迅速化、取締役会における経営戦略等の議論の一層の充実と監督機能の強化を実現するため、監査等委員会設置会社を採用しております。,https://disclosure2dl.edinet-fsa.go.jp/searchdocument/pdf/S100IS9D.pdf,Positive,"Overview of corporate rule system and reasons for adopting its systems, the business environment surrounding the Company is changing rapidly, further acceleration of management decisions, further enhancement of discussions on management strategy at the Board of Directors and supervision functions In order to achieve enhancement of, we have adopted a company with an audit committee."
715,665,当社は、株主総会、取締役会、監査等委員会等の法定の機関に加え、全社重要方針・施策の審議や経営管理に必要な情報の報告等を行うための経営会議、その他取締役会または社長の意思決定に資するための各種諮問機関を設けております。,https://disclosure2dl.edinet-fsa.go.jp/searchdocument/pdf/S100IS9D.pdf,Positive,"In addition to the legal organizations such as the General Meeting of Shareholders, the Board of Directors, and the Audit, the Company, the Directors and President of the Board of Directors, such as deliberation of the company's important policies and measures and reporting information necessary for management management. We have set various advisory organizations to contribute to the decision."
716,666,当社の取締役会は、経営の基本方針、経営戦略等の重要な業務執行を審議・決定し、また個々の取締役の職務の執行の監督を行っております。,https://disclosure2dl.edinet-fsa.go.jp/searchdocument/pdf/S100IS9D.pdf,Positive,"Our Board of Directors has deliberated and determined important business executions such as basic management policies and management strategies, and supervises the execution of individual directors."
717,667,なお、当社は、定款において、重要な業務執行の決定の全部または一部を取締役に委任することができる旨を定めております。,https://disclosure2dl.edinet-fsa.go.jp/searchdocument/pdf/S100IS9D.pdf,Positive,"In the articles of incorporation, we stipulate that all or part of the important business executions can be delegated to directors."
718,668,取締役会は15名で構成され、うち６名は独立性の高い社外取締役であります。,https://disclosure2dl.edinet-fsa.go.jp/searchdocument/pdf/S100IS9D.pdf,Positive,"The Board of Directors consists of 15 people, and six are outside the company with high independence."
719,669,当社の監査等委員会は、取締役会における議決権の行使及び株主総会における取締役（監査等委員である取締役を除く。）の人事、報酬に関する意見陳述権の行使等を通じて、取締役会の意思決定過程及び取締役の業務執行状況の監査・監督を行っております。,https://disclosure2dl.edinet-fsa.go.jp/searchdocument/pdf/S100IS9D.pdf,Positive,"Our audit committee, etc., exercise voting rights at the Board of Directors, and exercise opinions on rewards through the exercise of the reputation of rewards, such as the exercise of voting rights at the Board of Directors (excluding directors who are the audit, etc.) And we are auditing and supervising the business execution status of directors."
720,670,監査等委員会は６名で構成され、うち４名は独立性の高い社外取締役であります。,https://disclosure2dl.edinet-fsa.go.jp/searchdocument/pdf/S100IS9D.pdf,Positive,"The Audit Committee is composed of six people, and four are external directors with high independence."
721,671,当社は執行役員制度を導入しており、執行と経営の分離により、監督機関としての取締役会の実効性向上を図るとともに、取締役会の審議の充実と執行役員レベルへの権限委譲等による意思決定の迅速化を図るなど、経営効率の一層の向上に努めております。,https://disclosure2dl.edinet-fsa.go.jp/searchdocument/pdf/S100IS9D.pdf,Positive,"The Company has introduced an executive officer system, and will improve the effectiveness of the Board of Directors as a supervisory organization by separation of execution and management, enhance the deliberation of the Board of Directors and delegate the authority to the executive officer level. We are working to further improve management efficiency, such as speeding up."
722,672,当社は、取締役候補者及び執行役員の指名・選解任並びに報酬等について、透明性・公平性・客観性を一層高めるため、社外取締役６名を含む取締役９名で構成する「役員体制・報酬諮問委員会」を設置しております。,https://disclosure2dl.edinet-fsa.go.jp/searchdocument/pdf/S100IS9D.pdf,Positive,"The Company consists of nine directors, including six external directors, to further enhance transparency, fairness, and objectivity for the nominations and appointments of directors and executive officers, and rewards, etc. We have set up a committee."
723,673,同委員会は、取締役会の諮問機関として、役員の構成、候補者の育成・選定の方針等、当社の持続的な成長と中長期的な企業価値向上に資する報酬支給の方針及び方針に基づく報酬体系、プロセス等について審議しております。,https://disclosure2dl.edinet-fsa.go.jp/searchdocument/pdf/S100IS9D.pdf,Positive,"As an advisory body of the Board of Directors, the committee is based on the policy and policy of rewarding the company's sustainable growth and medium- to long -term improvement of the company, such as the composition of officers, the development and selection of candidates. We are discussing reward systems, processes, etc."
724,674,なお、同委員会の議長は、代表取締役会長が務めております。,https://disclosure2dl.edinet-fsa.go.jp/searchdocument/pdf/S100IS9D.pdf,Positive,The chairman of the committee is served by the Chairman and CEO.
725,676,こうした体制により、業務執行の権限と責任を明確にし、迅速かつ適正な意思決定を図り、経営の透明性や効率性の向上に努めております。,https://disclosure2dl.edinet-fsa.go.jp/searchdocument/pdf/S100IS9D.pdf,Positive,"With these systems, we will clarify the authority and responsibility of the business execution, make quick and appropriate decision -making, and improve the transparency and efficiency of management."
726,678,株主総会議事録、取締役会議事録その他の取締役の職務の執行に係る情報については、法令、定款及び関連社内規程に従い、適切に保存及び管理を行い、監査等委員会から閲覧要請がある場合はその閲覧に供する。,https://disclosure2dl.edinet-fsa.go.jp/searchdocument/pdf/S100IS9D.pdf,Positive,"For information on the General Meeting of Shareholders, the Board of Directors, and the execution of the duties of other directors, appropriately preserve and manage the laws and regulations, articles of incorporation, and related companies, and if there is a request from the audit committee, a request for viewing. Insert it to browsing."
727,679,リスクマネジメント基本ポリシー及び関連社内規程に従い、個別のビジネスリスクについては各担当部門が、全社レベルのリスクについては各主管部門が適切に管理を行う。,https://disclosure2dl.edinet-fsa.go.jp/searchdocument/pdf/S100IS9D.pdf,Positive,"In accordance with the Basic Risk Management Policy and Related Company Rules, each department in charge will properly manage individual business risks, and each custody division will properly manage the risks at the company."
728,680,経営上重大な事態や災害等の緊急事態が発生した場合は、社内規程に従い、必要に応じて緊急対策本部を設置するなど適切な措置を講じる。,https://disclosure2dl.edinet-fsa.go.jp/searchdocument/pdf/S100IS9D.pdf,Positive,"In the event of an emergency such as a serious management or disaster, etc., appropriate measures will be taken, such as setting up an emergency countermeasure headquarters in accordance with internal regulations."
729,681,全社的なリスクマネジメントの推進を担当する役員と部門を定め、リスク・コンプライアンス委員会における重点課題の設定、各部門におけるリスク管理状況の確認・評価などの活動により、リスクマネジメントの一層の強化充実を図る。,https://disclosure2dl.edinet-fsa.go.jp/searchdocument/pdf/S100IS9D.pdf,Positive,"The officers and departments in charge of promoting the company's company -wide risk management are determined, setting priority issues in the Risk Compliance Committee, confirmation and evaluation of risk management status in each department, further enhancing risk management. I will do it."
730,682,内部監査部門は、内部監査等を通じて、各部門におけるリスク管理状況を確認・評価するとともに、定期的に取締役会及び監査等委員会に報告する。,https://disclosure2dl.edinet-fsa.go.jp/searchdocument/pdf/S100IS9D.pdf,Positive,"The internal audit department will check and evaluate the risk management status in each department through internal audits, etc., and regularly report to the board of directors and audit."
731,683,経営計画のマネジメントについては、中長期の経営計画及び年度毎の事業計画に基づき、各業務執行ラインにおいて目標達成のために活動する。,https://disclosure2dl.edinet-fsa.go.jp/searchdocument/pdf/S100IS9D.pdf,Positive,"Regarding management of management plan, we will work to achieve the goal on each business execution line based on the medium- to long -term management plan and the business plan for each year."
732,684,業務執行のマネジメントについては、取締役会規程に定める付議事項に該当する事項すべてを取締役会に付議する。,https://disclosure2dl.edinet-fsa.go.jp/searchdocument/pdf/S100IS9D.pdf,Positive,"Regarding the management of business execution, all matters that fall under the matters specified in the Board of Directors will be discussed by the Board of Directors."
733,685,日常の職務遂行については、職務権限規程、業務分掌規程及び関連社内規程に基づく執行役員間の役割分担及び執行役員への権限委譲等により効率的に行う。,https://disclosure2dl.edinet-fsa.go.jp/searchdocument/pdf/S100IS9D.pdf,Positive,"Regarding the execution of daily duties, it is efficiently performed by division of roles between executive officers based on the rules of duties, business divisions, and related companies, and delegating authority to executive officers."
734,686,取締役会による監督機能の一層の強化及び経営の透明性の更なる向上を図るため、独立した立場の社外取締役を置く。,https://disclosure2dl.edinet-fsa.go.jp/searchdocument/pdf/S100IS9D.pdf,Positive,"In order to further strengthen supervision functions by the Board of Directors and further improve the transparency of management, an independent external director will be set up."
735,687,マツダ企業倫理行動規範の下、コンプライアンスを全社的に総括する役員と部門を置き、各部門長をコンプライアンス推進責任者とするコンプライアンス体制により、取締役その他の役員及び従業員の職務の執行が法令及び定款に適合することを確保するための取り組みを行う。,https://disclosure2dl.edinet-fsa.go.jp/searchdocument/pdf/S100IS9D.pdf,Positive,"Under Mazda Corporate Corporate Corporate Corporate Corporation, the execution of the duties of directors and employees by the compliance system in which each division is responsible for compliance promotion and other officers and departments who have compiled compliance throughout the company. Make an effort to secure to meet to."
736,688,コンプライアンスの推進業務は、リスク・コンプライアンス委員会で審議する全社推進方針に基づき、コンプライアンスを全社的に総括する部門が主管する。,https://disclosure2dl.edinet-fsa.go.jp/searchdocument/pdf/S100IS9D.pdf,Positive,"The promotion of compliance is based on the company's company -wide coordinates, based on the company's company's company promotion policy, which is discussed by the Risk Compliance Committee."
737,689,法令及びマツダ企業倫理行動規範に照らし、不適切な行為等があった場合、又はその疑いがある場合の通報窓口としてマツダ・グローバル・ホットライン(以下「ホットライン」という。)を設ける。,https://disclosure2dl.edinet-fsa.go.jp/searchdocument/pdf/S100IS9D.pdf,Positive,"Mazda Global Hotline (hereinafter referred to as ""hotline"") is provided as a report window in light of in light of laws and regulations and Mazda Corporate Corporate Ethics Conditions, or if there is any suspicion."
738,690,ホットラインは、匿名による通報を受け付けるとともに、通報窓口を第三者機関(弁護士)にも設ける。,https://disclosure2dl.edinet-fsa.go.jp/searchdocument/pdf/S100IS9D.pdf,Positive,The hotline accepts anonymous reports and also provides a report window in a third -party organization (lawyer).
739,691,子会社に対して、関連規程に従い、特定の事項、重要な業務上の課題等の解決について、当社への事前の報告又は当社の同意を得ることを求める。,https://disclosure2dl.edinet-fsa.go.jp/searchdocument/pdf/S100IS9D.pdf,Positive,"In accordance with the relevant regulations, we will request that the company will obtain a preliminary report or the consent of the Company on the solution of specific matters, important business issues, etc."
740,692,子会社に対して、リスクマネジメント基本ポリシー及び関連社内規程に従い、リスクマネジメントに適切に取り組むように指導・支援を行う。,https://disclosure2dl.edinet-fsa.go.jp/searchdocument/pdf/S100IS9D.pdf,Positive,We will provide guidance and support to the subsidiary so that the risk management is appropriate for the risk management in accordance with the basic risk management policies and related companies.
741,693,子会社に対して、当社グループの中長期の経営計画及び年度毎の事業計画、その他当社の政策と方針を展開するとともに、これらに沿った経営が行われるよう、指導・支援を行う。,https://disclosure2dl.edinet-fsa.go.jp/searchdocument/pdf/S100IS9D.pdf,Positive,"We will provide the subsidiary of the Group's medium- to long -term management plan, business plans for each year, and other policies and policies, and provide guidance and support so that management will be conducted in accordance with these."
742,694,子会社に随時発生する重要な経営上の諸問題を解決するための指導・支援を行う。,https://disclosure2dl.edinet-fsa.go.jp/searchdocument/pdf/S100IS9D.pdf,Positive,We provide guidance and support to solve important management issues that occur at any time to subsidiaries.
743,695,子会社に対して、マツダ企業倫理行動規範を展開するとともに、これに沿った経営が行われるよう、指導・支援を行う。,https://disclosure2dl.edinet-fsa.go.jp/searchdocument/pdf/S100IS9D.pdf,Positive,"The subsidiary will develop Mazda Corporate Corporate Ethics Conduct, and provide guidance and support so that management will be performed in accordance with this."
744,696,監査等委員会及び内部監査部門は、法令・定款の遵守状況やリスク管理状況について適宜、グループ会社監査を行う。,https://disclosure2dl.edinet-fsa.go.jp/searchdocument/pdf/S100IS9D.pdf,Positive,"The Audit, etc., and the internal audit department shall conduct a group company audit on the compliance status and risk management status of laws and regulations and articles of incorporation."
745,697,監査等委員会の職務を補助する組織を設置し、取締役（監査等委員である取締役を除く。）の指揮命令に服さない従業員（以下「監査等委員会スタッフ」という。）を置く。,https://disclosure2dl.edinet-fsa.go.jp/searchdocument/pdf/S100IS9D.pdf,Positive,"Establish an organization that assists the duties of the Audit Committee, etc. (except for directors who are the audit members, etc.), and have employees (hereinafter referred to as the ""Audit Committee Staff"")."
746,698,監査等委員会スタッフの人事異動及び人事評価については、人事部門は監査等委員（常勤）と事前協議を行う。,https://disclosure2dl.edinet-fsa.go.jp/searchdocument/pdf/S100IS9D.pdf,Positive,"Regarding personnel changes and personnel evaluation of the audit committee staff and personnel evaluation, the HR department shall conduct prior consultation with the audit (full -time)."
747,699,監査等委員会スタッフは、他部署の使用人を兼務せず、監査等委員会の指揮命令に従わなければならない。,https://disclosure2dl.edinet-fsa.go.jp/searchdocument/pdf/S100IS9D.pdf,Positive,The audit committee staff must not be served as servants in other departments and obey the command order of the Audit.
748,700,取締役（監査等委員である取締役を除く。以下本項において同じ。）及び執行役員は、会社に著しい損害を及ぼす恐れのある事実を発見したときは直ちに監査等委員会に報告する。,https://disclosure2dl.edinet-fsa.go.jp/searchdocument/pdf/S100IS9D.pdf,Positive,"Directors (excluding directors who are the audit members, the same in this section, hereinafter referred to as in this section) and executive officers will immediately report to the Audit Committee if they find facts that may cause significant damage to the company."
749,701,取締役及び執行役員は、重大な訴訟・係争、会計方針の変更、重大な事故、当局から受けた行政処分、その他監査等委員会が取締役及び執行役員と協議して定める事項については、会社に著しい損害を及ぼす恐れのある事実に該当しない場合であっても、監査等委員会に報告する。,https://disclosure2dl.edinet-fsa.go.jp/searchdocument/pdf/S100IS9D.pdf,Positive,"Directors and executive officers have significant litigation and dispute, changes in accounting policies, serious accidents, administrative sanctions from authorities, and other matters specified in consultation with directors and executive officers. Report to the Audit Committee, even if it does not fall under the damages."
