,ID,Sentence,URL,Sentiment,translated
463,215,アカウンタビリティの充実としては、サステナビリティ会議の下に属する補助的な会議体として、情報開示の正確性・公正性および適時性を確保するために経理本部長を委員長とする「情報開示委員会」を設置しています。,https://disclosure2dl.edinet-fsa.go.jp/searchdocument/pdf/S100IUNR.pdf,Positive,"As an auxiliary conference belonging to the sustainability conference, the accuracy of information disclosure is the chairman of the Accounting Headquarters as a supplementary conference belonging to the sustainability meeting. It is installed."
464,216,情報開示委員会は、金融商品取引法に基づく有価証券報告書、四半期報告書、ならびに米国証券取引所法に基づく年次報告書(Form20-F)の作成、報告および評価を目的とした定例委員会を開催するほか、必要な場合には、臨時委員会を適時開催しています。,https://disclosure2dl.edinet-fsa.go.jp/searchdocument/pdf/S100IUNR.pdf,Positive,"The Information Disclosure Committee is a regular committee member aimed at creating, reporting and evaluating the year-end reports based on the Financial Instruments and Exchange Law, and the year-end report (Form20-F) based on the US Stock Exchange Law. In addition to holding a meeting, we are holding a temporary committee in a timely manner if necessary."
465,217,当社は、お客様の声や現場の情報を迅速に経営陣に伝え、適時・的確な経営判断を実現することに加え、その経営判断がお客様や社会に受け入れていただけるものかを常にチェックできる体制を構築することが重要であると考えています。,https://disclosure2dl.edinet-fsa.go.jp/searchdocument/pdf/S100IUNR.pdf,Positive,"We have a system that allows our customers to communicate their voices and on -site information to their management, realize timely and accurate management decisions, and constantly check whether their management decisions can be accepted by customers and society. We believe it is important to build."
466,218,当社としては、社外取締役を含む取締役会と、社外監査役を含む監査役会により、業務執行を監督・監査する現体制が最適であると考えています。,https://disclosure2dl.edinet-fsa.go.jp/searchdocument/pdf/S100IUNR.pdf,Positive,"We believe that the current system of supervision and audit of business execution is optimal by the Board of Directors, including the outside directors, and the Audit & Supervisory Board of Audit & Supervisory Boards."
467,220,当社は、「トヨタ基本理念」および「トヨタ行動指針」に基づき、子会社を含めて健全な企業風土を醸成しています。,https://disclosure2dl.edinet-fsa.go.jp/searchdocument/pdf/S100IUNR.pdf,Positive,"We are fostering healthy corporate culture, including subsidiaries, based on the ""Basic Philosophy of Toyota"" and ""Toyota Action Guidelines""."
468,221,実際の業務執行の場においては、業務執行プロセスの中に問題発見と改善の仕組みを組み込むとともに、それを実践する人材の育成に不断の努力を払っています。,https://disclosure2dl.edinet-fsa.go.jp/searchdocument/pdf/S100IUNR.pdf,Positive,"In the actual business execution, we incorporate a mechanism for discovering and improving problems in the business execution process, and is making constant efforts to develop human resources who practice it."
469,222,当社は、「内部統制の整備に関する基本方針」に基づき、企業集団としての業務の適正を確保するための体制整備とその適切な運用に努めています。,https://disclosure2dl.edinet-fsa.go.jp/searchdocument/pdf/S100IUNR.pdf,Positive,"Based on the ""Basic Policy on the Development of internal control,"" we strive to establish a system to ensure the appropriateness of business as a corporate group and its appropriate operation."
470,223,また、毎事業年度、内部統制の整備・運用状況の点検を行い、内部統制の運用実施部署における活動が自律的に実施され、必要に応じ強化が図られていることを確認するとともに、その内容をサステナビリティ会議および取締役会で確認しています。,https://disclosure2dl.edinet-fsa.go.jp/searchdocument/pdf/S100IUNR.pdf,Positive,"In addition, we will inspect the maintenance and operation status of internal controls in each fiscal year, confirm that activities in the operation and implementation department of internal controls have been implemented autonomously, and that they are enhanced as necessary. Is confirmed by the Sustainability Conference and the Board of Directors."
471,224,以上の認識を基盤にした、会社法所定の以下の項目に関する当社の基本方針は次のとおりです。,https://disclosure2dl.edinet-fsa.go.jp/searchdocument/pdf/S100IUNR.pdf,Positive,The basic policy of the following items based on the above recognition is as follows:
472,225,倫理規程、取締役に必要な法知識をまとめた解説書等を用い、新任役員研修等の場において、取締役が法令および定款に則って行動するよう徹底します。,https://disclosure2dl.edinet-fsa.go.jp/searchdocument/pdf/S100IUNR.pdf,Positive,"Using the ethics regulations and the commentary books that summarize the legal knowledge necessary for directors, the directors will act in accordance with the laws and regulations and articles of incorporation in newly appointed executive training."
473,226,業務執行にあたっては、取締役会および組織横断的な各種会議体で、総合的に検討したうえで意思決定を行います。,https://disclosure2dl.edinet-fsa.go.jp/searchdocument/pdf/S100IUNR.pdf,Positive,"In execution, the Board of Directors and various inter -organizations will make decisions comprehensively and make decisions."
474,227,また、これらの会議体への付議事項を定めた規程に基づき、適切に付議します。,https://disclosure2dl.edinet-fsa.go.jp/searchdocument/pdf/S100IUNR.pdf,Positive,"In addition, we will appropriately discuss based on the rules that have determined the matters to these conferences."
475,228,企業倫理、コンプライアンスおよびリスク管理に関する重要課題と対応についてサステナビリティ会議等で適切に審議します。,https://disclosure2dl.edinet-fsa.go.jp/searchdocument/pdf/S100IUNR.pdf,Positive,"We will properly discuss important issues and response to corporate ethics, compliance and risk management at sustainability meetings."
476,229,取締役を含む役員が遵守すべき基本的事項を「トヨタ基本理念」「トヨタ行動指針」「役員倫理規程」等に規定し、各役員に周知しています。,https://disclosure2dl.edinet-fsa.go.jp/searchdocument/pdf/S100IUNR.pdf,Positive,"The basic matters that executives, including directors, should be complied with in the ""Toyota Basic Philosophy"", ""Toyota Action Guidelines"", ""Officer Ethics Regulations"", etc., and inform each officer."
477,230,また、役員が留意すべき法令や定款の内容をマニュアルに記載し、各役員に周知しています。,https://disclosure2dl.edinet-fsa.go.jp/searchdocument/pdf/S100IUNR.pdf,Positive,"In addition, the officers should be aware of the laws and regulations and the contents of the articles of incorporation in the manual and inform each executive."
478,231,さらに、新任役員就任時にマニュアルを用いてコンプライアンスに関する教育を行っています。,https://disclosure2dl.edinet-fsa.go.jp/searchdocument/pdf/S100IUNR.pdf,Positive,"In addition, we provide education on compliance using a manual when you become a new officer."
479,232,業務執行にあたっては、会議体への付議事項を定めた規程に基づき、取締役会および組織横断的な各種会議体に適切に付議し、総合的に検討したうえで意思決定を行っています。,https://disclosure2dl.edinet-fsa.go.jp/searchdocument/pdf/S100IUNR.pdf,Positive,"In execution, we make appropriate decisions after the Board of Directors and cross -organized conferences, based on the rules stipulated to the constituent, and are comprehensively examined."
480,233,取締役会では、(１)会社法および他の法令に規定された事項、(２)定款に規定された事項、(３)株主総会の決議により委任された事項、(４)その他経営上の重要な事項を決議事項とし、(１)業務の執行の状況、その他会社法および他の法令に規定された事項、(２)その他取締役会が必要と認めた事項を報告事項として定めています。,https://disclosure2dl.edinet-fsa.go.jp/searchdocument/pdf/S100IUNR.pdf,Positive,"In the Board of Directors, (1) matters prescribed in the Companies Act and other laws, (2) matters specified in the Articles of Incorporation, (3) the matters delegated by the resolution of the General Meeting of Shareholders, (4) and other important management. The resolution is as a resolution, (1) the status of (1) the status of the execution of the work, the matters specified in the corporate law and other laws and regulations, and (2) other matters deemed necessary by the Board of Directors as a report."
481,234,「トヨタ基本理念」「トヨタグローバルビジョン」等の精神に則り中長期的に持続的成長するガバナンス体制の実現を目的に、サステナビリティ、企業倫理、コンプライアンスおよびリスク管理に関する重要課題と対応について、サステナビリティ会議で適切に審議しています。,https://disclosure2dl.edinet-fsa.go.jp/searchdocument/pdf/S100IUNR.pdf,Positive,"At the Sustainability Conference on Sustainability Conference on Sustainability, Corporate Ethics, Compliance and Risk Management, important issues and response to the purpose of realizing the medium- to long -term governance system in accordance with the spirit of ""Toyota Basic Philosophy"" and ""Toyota Global Vision"". We are deliberately discussing."
482,235,取締役の職務の執行に係る情報は、関係規程ならびに法令に基づき、各担当部署に適切に保存および管理させます。,https://disclosure2dl.edinet-fsa.go.jp/searchdocument/pdf/S100IUNR.pdf,Positive,"The information pertaining to the execution of the duties of the director will be properly preserved and managed by the department in charge, based on the relevant regulations and laws and regulations."
483,236,関係規程および法令に基づき、各担当部署に取締役の職務の執行に必要となる会議体資料や議事録等の情報を適切に保存および管理させています。,https://disclosure2dl.edinet-fsa.go.jp/searchdocument/pdf/S100IUNR.pdf,Positive,"Based on the relevant regulations and laws and regulations, the department in charge is appropriately preserved and managed information such as conference materials and minutes required to execute the duties of directors."
484,237,また、機密管理を含めた情報セキュリティ全般に対して、グローバルな推進体制や仕組みを整備するとともに、当社および子会社の取り組み状況の点検を定期的に行っています。,https://disclosure2dl.edinet-fsa.go.jp/searchdocument/pdf/S100IUNR.pdf,Positive,"In addition, we provide global propulsion and mechanisms for general information security, including confidential management, and regularly check the status of our and subsidiaries."
485,238,予算制度等により資金を適切に管理するとともに、稟議制度等により所定の権限および責任に基づいて業務および予算の執行を行います。,https://disclosure2dl.edinet-fsa.go.jp/searchdocument/pdf/S100IUNR.pdf,Positive,"We will properly manage the funds by the budget system, etc., and execute the work and budget based on the predetermined permissions and responsibilities by the approval system."
486,239,重要案件については、取締役会や各種会議体への付議基準を定めた規程に基づき、適切に付議します。,https://disclosure2dl.edinet-fsa.go.jp/searchdocument/pdf/S100IUNR.pdf,Positive,Important projects will be appropriately discussed based on the rules that set the standards for the Board of Directors and various conferences.
487,240,資金の流れや管理の体制を文書化する等、適正な財務報告の確保に取り組むほか、情報開示委員会を通じて、適時適正な情報開示を確保します。,https://disclosure2dl.edinet-fsa.go.jp/searchdocument/pdf/S100IUNR.pdf,Positive,"In addition to securing appropriate financial reports, such as documenting fund flow and management systems, we will secure timely information disclosure through the Information Disclosure Committee."
488,241,安全、品質、環境等のリスクおよびコンプライアンスについて、各担当部署が、必要に応じ各地域と連携した体制を構築するとともに、規則を制定し、またはマニュアルを作成し配付すること等により、管理します。,https://disclosure2dl.edinet-fsa.go.jp/searchdocument/pdf/S100IUNR.pdf,Positive,"Regarding the risks and quality of safety, quality, environment, etc., each department in charge will manage a system in collaboration with each region as needed, establish and distribute the rules, or create and distribute a manual. 。"
489,242,災害等の発生に備えて、マニュアルの整備や訓練を行うほか、必要に応じて、リスク分散措置および保険付保等を行います。,https://disclosure2dl.edinet-fsa.go.jp/searchdocument/pdf/S100IUNR.pdf,Positive,"In addition to the development and training of the manual in preparation for the occurrence of disasters, etc., as needed, risk distribution measures and insurance will be carried out."
490,243,収益計画に基づき、一般経費、試験研究費、設備投資等の費目ごとに決められた管理部署へ予算を割り当て、予算管理を行っています。,https://disclosure2dl.edinet-fsa.go.jp/searchdocument/pdf/S100IUNR.pdf,Positive,"Based on the profit plan, we allocate budgets to the administrative department determined for each expense, test research expenses, and capital investment, and manage budgets."
491,244,重要案件については、取締役会や各種会議体への付議基準を定めた規程に基づき、適切に付議しています。,https://disclosure2dl.edinet-fsa.go.jp/searchdocument/pdf/S100IUNR.pdf,Positive,Important projects are appropriately discussed based on the rules of the Board of Directors and various conferences.
492,245,適正な財務報告を確保するため、連結財務報告作成のために収集している財務情報について解説書を作成し、必要に応じて子会社に展開しています。,https://disclosure2dl.edinet-fsa.go.jp/searchdocument/pdf/S100IUNR.pdf,Positive,"In order to secure an appropriate financial report, we have created a commentary on financial information collected to create consolidated financial reports, and deploy it to a subsidiary as needed."
493,246,また、適時適正な情報開示を確保するため、情報開示委員会を通じて、情報の収集、開示要否の判断を行っています。,https://disclosure2dl.edinet-fsa.go.jp/searchdocument/pdf/S100IUNR.pdf,Positive,"In addition, in order to secure timely information disclosure, information disclosure committee is collected and required to be disclosed."
494,247,法の要請により、当社および重要な子会社の各プロセスについて文書化を行ったうえ、財務報告に係る内部統制の有効性を評価しています。,https://disclosure2dl.edinet-fsa.go.jp/searchdocument/pdf/S100IUNR.pdf,Positive,"At the request of the law, the processes of the Company and the important subsidiaries are documented, and the effectiveness of internal controls related to financial reports is evaluated."
495,248,また、開示プロセスの有効性を評価しています。,https://disclosure2dl.edinet-fsa.go.jp/searchdocument/pdf/S100IUNR.pdf,Positive,It also evaluates the effectiveness of the disclosure process.
496,249,安全、品質、環境等のグローバルリスクマネジメントの責任者であるCROのもとに、各地域を統括する地域CROを設置し、各地域のリスクマネジメント体制の構築を行っています。,https://disclosure2dl.edinet-fsa.go.jp/searchdocument/pdf/S100IUNR.pdf,Positive,"Based on the CRO, which is responsible for global risk management such as safety, quality, and environment, we have established regional CROs that supervise each region, and build a risk management system in each region."
497,250,また、社内のヘッドオフィスでは機能別リスク担当として各本部長・各部門リスク責任者を、各カンパニーでは製品別のリスク担当として各プレジデント・リスク責任者を任命し、各地域本部と連携・サポートしあえる体制をとっており、必要に応じて見直しや強化を図っています。,https://disclosure2dl.edinet-fsa.go.jp/searchdocument/pdf/S100IUNR.pdf,Positive,"In addition, in the head office in the company, the director and risk of each division of risk as a risk -by -functional risk, and in each company, the responsible person in charge of each President and Risk is appointed as risks by product, and will cooperate and support with each regional headquarters. We have a system to do, and we are reviewing and strengthening as needed."
498,251,品質については、Global-CQO(ChiefQualityOfficer)が各地域のRegional-CQOを統括し、お客様の声と真摯に向き合った製品・サービス品質の向上、また法規動向に対応したモノづくりを全社グローバル一体となって推進しています。,https://disclosure2dl.edinet-fsa.go.jp/searchdocument/pdf/S100IUNR.pdf,Positive,"Regarding quality, Global-CQO (ChiefQualityOfficer) will oversee Regional-CQO in each region, improve products and service quality that seriously face customer voices, and make things that support legal trends. We are promoting."
499,252,また、市場の状況を注視し、品質リスクに対するマネジメント体制を維持、強化しています。,https://disclosure2dl.edinet-fsa.go.jp/searchdocument/pdf/S100IUNR.pdf,Positive,"In addition, we are closing and strengthening the management system for quality risks."
500,253,災害等に備え、生産復旧、システム復旧などに向けたBusinessContinuityPlan(BCP)を本部および部ごとに策定し、毎年定期的な訓練(初動対応・復旧対応)を行うことで改善を続けています。,https://disclosure2dl.edinet-fsa.go.jp/searchdocument/pdf/S100IUNR.pdf,Positive,"In preparation for disasters, etc., we formulate BusinessContinuityPlan (BCP) for each headquarters and departments for production recovery, system recovery, etc., and continues to improve by performing regular training (initial and recovery support) every year."
501,254,また、当社のBusinessContinuityManagement(BCM)は「従業員・家族」「トヨタグループ・仕入先等」「トヨタ」が三位一体となった活動として推進しています。,https://disclosure2dl.edinet-fsa.go.jp/searchdocument/pdf/S100IUNR.pdf,Positive,"In addition, our BusinessContinuityManageMENT (BCM) is promoted as an activity that has become a trinity of employees, families, Toyota Groups, suppliers, etc., and Toyota."
502,255,中長期の経営方針および年度ごとの会社方針をもとに、組織の各段階で方針を具体化し、一貫した方針管理を行います。,https://disclosure2dl.edinet-fsa.go.jp/searchdocument/pdf/S100IUNR.pdf,Positive,"Based on the medium- to long -term management policy and the company policy for each fiscal year, the policy will be embodied at each stage of the organization, and the policy is consistently managed."
503,256,取締役は、現場からの的確な情報に基づき、経営方針を迅速に決定するとともに、当社の強みである「現場重視」の考え方のもと、各地域、各機能、各工程における業務執行の責任者を定め、幅広い権限を与えます。,https://disclosure2dl.edinet-fsa.go.jp/searchdocument/pdf/S100IUNR.pdf,Positive,"Directors will promptly determine the management policy based on accurate information from the site, and in charge of business execution in each region, each function, and each process, based on the concept of our strengths, ""on -site -oriented"". And gives a wide range of authority."
504,257,各業務執行責任者は、経営方針達成のため、それぞれの業務計画を主体的に策定し、機動的な執行を行い、取締役はこれを監督します。,https://disclosure2dl.edinet-fsa.go.jp/searchdocument/pdf/S100IUNR.pdf,Positive,"In order to achieve the management policy, each business executive will independently formulate each business plan, make a flexible execution, and the director will supervise this."
505,258,随時、各地域の外部有識者をはじめとした様々なステークホルダーの意見を聞く機会を設け、経営や企業行動のあり方に反映させます。,https://disclosure2dl.edinet-fsa.go.jp/searchdocument/pdf/S100IUNR.pdf,Positive,"We will have the opportunity to hear the opinions of various stakeholders, including external experts in each region, and reflect them in management and corporate behavior."
506,259,中長期的なお客様の価値観や技術のトレンド等を勘案した長期事業戦略を踏まえ、地域別の中期経営計画およびカンパニー経営プランを策定しています。,https://disclosure2dl.edinet-fsa.go.jp/searchdocument/pdf/S100IUNR.pdf,Positive,"Based on the long -term business strategy in consideration of the medium- to long -term customer values ​​and technology trends, we have formulated a medium -term management plan and a company management plan for each region."
507,260,また、その年に会社として進むべき大きな方向性を定めた「方針指針」を策定し、組織の各段階で方針を具体化することで、一貫した方針管理を行っています。,https://disclosure2dl.edinet-fsa.go.jp/searchdocument/pdf/S100IUNR.pdf,Positive,"In that year, we formulate a ""policy guideline"" that stipulates the great direction to proceed as a company, and concrete the policy at each stage of the organization, to manage consistently."
508,261,商品群ごとに「カンパニー」を設置するとともに、各地域、各機能、各工程を「本部」と位置づけ、カンパニー・本部の中の各部が中心となって業務執行を行うという現場主義で全社網羅的な組織を採用しています。,https://disclosure2dl.edinet-fsa.go.jp/searchdocument/pdf/S100IUNR.pdf,Positive,"In addition to installing a ""company"" for each product group, each region, each function, and each process are positioned as ""headquarters"", and the business execution is performed mainly by each part of the company and headquarters. We are adopting a tissue."
509,262,取締役会においては、執行役員である社長・チーフオフィサーから、現場に即した会社の状況を適切に提供を受けて、効率的な意思決定を行っています。,https://disclosure2dl.edinet-fsa.go.jp/searchdocument/pdf/S100IUNR.pdf,Positive,"The Board of Directors has made efficient decision -making from the president, Chief Officer, an executive officer, with appropriately providing the situation of the company in line with the site."
510,263,業務執行責任者であるカンパニープレジデントや本部長は、組織の方針を自律的に策定・運営し、チーフオフィサー以上はこれを監督しています。,https://disclosure2dl.edinet-fsa.go.jp/searchdocument/pdf/S100IUNR.pdf,Positive,"Company President and Headquarters, who are in charge of business executions, have autonomously formulated and operated organizations, and supervise more than Chief Officers."
511,264,各地域の外部有識者をはじめとした様々なステークホルダーの意見を聞く機会を設け、社外の視点からのアドバイスや情報を入手することにより、経営や企業行動のあり方の検討に役立てています。,https://disclosure2dl.edinet-fsa.go.jp/searchdocument/pdf/S100IUNR.pdf,Positive,"We have the opportunity to hear the opinions of various stakeholders, including external experts in each region, and obtain advice and information from outside the company, to consider management and corporate behavior."
512,265,各組織の業務分掌を明確化するとともに、継続的な改善を図る土壌を維持します。,https://disclosure2dl.edinet-fsa.go.jp/searchdocument/pdf/S100IUNR.pdf,Positive,We will clarify the dividends of each organization and maintain the soil to make continuous improvement.
513,266,法令遵守およびリスク管理の仕組みを不断に見直し、実効性を確保します。,https://disclosure2dl.edinet-fsa.go.jp/searchdocument/pdf/S100IUNR.pdf,Positive,Review the mechanism of legal compliance and risk management to ensure effectiveness.
