,ID,Sentence,URL,Sentiment,translated
235,574,インフラへの投資（米国新工場の建設、IT投資など）,https://disclosure2dl.edinet-fsa.go.jp/searchdocument/pdf/S100IS9D.pdf,N/A,"Investment in infrastructure (construction of new US factory, IT investment, etc.)"
236,577,中期経営計画の最終年度となる2025年３月期の財務指標は以下のとおりです。,https://disclosure2dl.edinet-fsa.go.jp/searchdocument/pdf/S100IS9D.pdf,N/A,"The financial indicators for the fiscal year ending March 202, 2025, the final year of the medium -term management plan are as follows."
237,578,３月中旬以降、世界的な感染拡大により、グローバルで販売が急激に減少し、同時に販売会社での在庫が増加しました。,https://disclosure2dl.edinet-fsa.go.jp/searchdocument/pdf/S100IS9D.pdf,N/A,"Since mid -March, the spread of global infection has rapidly decreased globally, and at the same time, stocks at sales companies have increased."
238,579,販売減少及び在庫増に対し、工場の操業停止を行うなど生産調整を実施し、在庫の適正化を行いました。,https://disclosure2dl.edinet-fsa.go.jp/searchdocument/pdf/S100IS9D.pdf,N/A,"Production and adjustment were implemented, such as stopping the operation of the factory for the decrease in sales and the increase in inventory, and the inventory was optimized."
239,580,現在、販売は徐々に回復基調にあり、７月には国内工場を昼夜勤務の２直操業に再開します。,https://disclosure2dl.edinet-fsa.go.jp/searchdocument/pdf/S100IS9D.pdf,N/A,"Currently, sales are gradually recovering, and in July, we will resume domestic factories to two direct operation for day and night."
240,581,今後も各国の販売や在庫の状況を注視しながら、感染が再び拡大するリスクも視野に入れ、慎重かつ柔軟に対応していきます。,https://disclosure2dl.edinet-fsa.go.jp/searchdocument/pdf/S100IS9D.pdf,N/A,"In the future, while watching the sales and inventory status of each country, we will respond carefully and flexibly, taking into account the risks that the infection will expand again."
241,582,なお、販売減少に伴い売上収入が縮小する中、国内外の子会社を含め、資金確保のために緊急支出抑制と資金調達を行いました。,https://disclosure2dl.edinet-fsa.go.jp/searchdocument/pdf/S100IS9D.pdf,N/A,"With the decline in sales, sales revenues were reduced, and urgent expenditures were suppressed and funded to secure funds, including subsidiaries in Japan and overseas."
242,584,コロナ禍の影響で世界の自動車需要回復の見通しは不透明であり、また厳しい状況も想定されます。,https://disclosure2dl.edinet-fsa.go.jp/searchdocument/pdf/S100IS9D.pdf,N/A,"The prospect of recovery from the world's automobile demand is uncertain due to the corona evil, and a severe situation is assumed."
243,585,この事業環境に対して、中期経営方針は維持しながらも、あらゆる領域での効率化を最大限に図った上で、中期経営計画の施策や目標は、その規模やタイミングの見直しを行っていきます。,https://disclosure2dl.edinet-fsa.go.jp/searchdocument/pdf/S100IS9D.pdf,N/A,"In response to this business environment, while maintaining the medium -term management policy, the measures and goals of the medium -term management plan will be reviewed by maximizing efficiency in all areas. Masu."
244,586,なお、早急に対応すべき具体的な取り組みは以下の通りです。,https://disclosure2dl.edinet-fsa.go.jp/searchdocument/pdf/S100IS9D.pdf,N/A,The specific initiatives that need to respond immediately are as follows.
245,587,あらゆる費用の効率化を目指すこと,https://disclosure2dl.edinet-fsa.go.jp/searchdocument/pdf/S100IS9D.pdf,N/A,Aiming to improve the efficiency of all costs
246,588,2020年３月期に実現させた販売の質を維持しながら、売上・台数の成長を両立させ、いち早く成長軌道に戻すこと,https://disclosure2dl.edinet-fsa.go.jp/searchdocument/pdf/S100IS9D.pdf,N/A,"While maintaining the quality of sales that were realized in the fiscal year ending March 2020, the growth of sales and the number of units should be achieved, and it will be returned quickly to the growth orbital."
247,589,在庫の量と質を改善し、売上を増やすとともに、キャッシュ創出力の見直しを行うこと,https://disclosure2dl.edinet-fsa.go.jp/searchdocument/pdf/S100IS9D.pdf,N/A,"Improve inventory quantity and quality, increase sales, and review cache creation."
248,590,将来の成長のための研究開発活動や設備投資は、効率を追求しながら実行すること,https://disclosure2dl.edinet-fsa.go.jp/searchdocument/pdf/S100IS9D.pdf,N/A,R & D activities and capital investment for future growth should be implemented in pursuit of efficiency
249,591,今回のコロナ禍の厳しい経験を梃子に、経営改革を加速し、今後の経済危機に対してもより危機耐性を高めたビジネス構造の構築を目指してまいります。,https://disclosure2dl.edinet-fsa.go.jp/searchdocument/pdf/S100IS9D.pdf,N/A,"With the harsh experience of the corona, we will accelerate management reforms and build a business structure that will increase crisis resistance to future economic crisis."
250,592,文中における将来に関する事項につきましては、本報告書提出時点において当社グループが判断した一定の前提に基づいたものであります。,https://disclosure2dl.edinet-fsa.go.jp/searchdocument/pdf/S100IS9D.pdf,N/A,The matters related to the future in the sentence is based on a certain premise determined by the Company at the time of this report.
251,593,これらの記載は実際の結果とは異なる可能性があり、その達成を保証するものではありません。,https://disclosure2dl.edinet-fsa.go.jp/searchdocument/pdf/S100IS9D.pdf,N/A,"These descriptions may be different from the actual results, and does not guarantee the achievement."
252,594,当社グループの経営成績及び財政状態に影響を及ぼす可能性のあるリスクには、主として以下のようなものがあります。,https://disclosure2dl.edinet-fsa.go.jp/searchdocument/pdf/S100IS9D.pdf,N/A,The following is a risk that can affect the business performance and financial status of the Company.
253,595,以下に記載する事項は、当連結会計年度末現在において予想される主なリスクを記載したものであり、ここに記載されたものが当社グループのすべてのリスクではありません。,https://disclosure2dl.edinet-fsa.go.jp/searchdocument/pdf/S100IS9D.pdf,N/A,"The following items described below are the expected main risks as of the end of the current consolidated fiscal year, and the ones listed here are not all risks of the Group."
254,596,なお、文中における将来に関する事項につきましては当連結会計年度末現在において当社グループが判断したものであります。,https://disclosure2dl.edinet-fsa.go.jp/searchdocument/pdf/S100IS9D.pdf,N/A,"As of the end of the current consolidated fiscal year, the group of the future in the sentence was determined by the Group."
255,597,当社グループの事業を取り巻く経済情勢当社グループは、日本を始め北米、欧州、アジアを含む世界各地域に製品を販売しており、それぞれの市場における景気動向や需要変動に強い影響を受けています。,https://disclosure2dl.edinet-fsa.go.jp/searchdocument/pdf/S100IS9D.pdf,N/A,"The Group, which surrounds the Group's business, sells products in regions, including Japan, North America, Europe, and Asia, and are strongly affected by economic trends and demand fluctuations in each market."
256,598,従いまして、当社グループの主要市場において、景気の減速または後退、需要構造の変化、需要減少、価格競争の激化等が進むことにより、当社グループの経営成績と財政状態に悪影響を及ぼす可能性があります。,https://disclosure2dl.edinet-fsa.go.jp/searchdocument/pdf/S100IS9D.pdf,N/A,"Therefore, in the major markets of the Group, the deceleration or recession of the economy, the change of demand structure, the decrease in demand, and the intensifying price competition may adversely affect the management performance and financial status of the Company. 。"
257,599,当社グループは、日本から世界各地域へ製品を輸出しているほか、海外の工場で製造した製品を世界の他の市場へ輸出するなど、グローバルな事業活動を展開しています。,https://disclosure2dl.edinet-fsa.go.jp/searchdocument/pdf/S100IS9D.pdf,N/A,"The Group has exported products from Japan to all over the world, and is developing global business activities, such as exporting products manufactured in overseas factories to other markets around the world."
258,600,これらの取引は様々な通貨を通じて行われているため、為替レートの変動は当社グループの経営成績と財政状態に影響を与えます。,https://disclosure2dl.edinet-fsa.go.jp/searchdocument/pdf/S100IS9D.pdf,N/A,"Since these transactions are performed through various currencies, fluctuations in exchange rates affect the business performance and financial status of the Group."
259,601,加えて、海外の現地通貨建の資産・負債等を円換算しているため、為替レート変動により、為替換算調整勘定を通じて自己資本に悪影響を及ぼす可能性があります。,https://disclosure2dl.edinet-fsa.go.jp/searchdocument/pdf/S100IS9D.pdf,N/A,"In addition, since the exchange rate fluctuations of local currency assets and debt of overseas local currency, the exchange rate fluctuations may adversely affect the capital through the exchange rate adjustment account."
260,602,また、為替レート変動リスクを最小限にするために為替予約を行っていますが、為替レートの変動状況によっては機会損失が発生する可能性があります。,https://disclosure2dl.edinet-fsa.go.jp/searchdocument/pdf/S100IS9D.pdf,N/A,"In addition, we make a foreign exchange reservation to minimize the risk of exchange rate fluctuation, but there is a possibility that the opportunity loss will occur depending on the exchange rate fluctuation status."
261,603,当社グループは、事業展開する各国において、燃費及び排気ガス、車両の安全性、製造工場からの汚染物質排出レベルに関する規制などの環境規制のほか、労働規制など、様々な法的規制を受けています。,https://disclosure2dl.edinet-fsa.go.jp/searchdocument/pdf/S100IS9D.pdf,Neutral,"The Group has received various legal regulations, including environmental regulations, such as fuel economy, exhaust gas, vehicle safety, restrictions on pollutant emissions from manufacturing plants, and labor regulations. 。"
262,605,当社グループは、原材料及び部品の購入を複数のグループ外のサプライヤーに依存しています。,https://disclosure2dl.edinet-fsa.go.jp/searchdocument/pdf/S100IS9D.pdf,Neutral,The Group depends on multiple outdoor suppliers to purchase raw materials and parts.
263,607,当社グループは、日本を始め世界各地域に製品を販売しており、米国、欧州及び発展途上市場や新興市場を含む海外市場において事業活動を行っています。,https://disclosure2dl.edinet-fsa.go.jp/searchdocument/pdf/S100IS9D.pdf,N/A,"The Group sells products to Japan and other regions, and is engaged in business activities in the United States, Europe, developing markets and emerging markets."
264,608,これらの海外市場での事業展開には以下のようなリスクが内在しており、当該リスクの顕在化により、当社グループの経営成績と財政状態に悪影響を及ぼす可能性があります。,https://disclosure2dl.edinet-fsa.go.jp/searchdocument/pdf/S100IS9D.pdf,N/A,"The following risks are in -house in these overseas markets, and the revival of the risks may adversely affect the business performance and financial status of the Company."
265,610,なお、新型コロナウイルス感染症については、今後の感染再拡大にともなう各国での規制措置等の状況によっては、当社グループの経営成績と財政状態に悪影響を及ぼす可能性があります。,https://disclosure2dl.edinet-fsa.go.jp/searchdocument/pdf/S100IS9D.pdf,N/A,"The new colon viral infections may have a negative effect on the business performance and financial status of the Group, depending on the status of regulatory measures in each country due to the re -expansion of infection."
266,611,当社グループは、製造設備等の主要施設に関して、防火、耐震対策などを実施すると共に、財務リスクを最小化すべく災害保険加入等の対策を行っています。,https://disclosure2dl.edinet-fsa.go.jp/searchdocument/pdf/S100IS9D.pdf,N/A,"The Group will implement fire prevention and seismic measures for major facilities such as manufacturing equipment, and also take measures such as disaster insurance to minimize financial risks."
267,612,しかしながら、大規模な地震、台風、豪雨、洪水等の自然災害及び火災等の事故の発生により製品供給に重大な支障を来たした場合、当社グループの経営成績と財政状態に悪影響を及ぼす可能性があります。,https://disclosure2dl.edinet-fsa.go.jp/searchdocument/pdf/S100IS9D.pdf,N/A,"However, if large -scale earthquakes, typhoons, heavy rains, floods, etc. have caused a significant problem of product supply due to accidents such as fire, such as the occurrence of accidents such as fire, the possibility of adverse effects on the management performance and financial status of the Group. there is."
268,613,当社グループは、銀行からの借入に加え、株式及び社債の発行等により資金調達を行っています。,https://disclosure2dl.edinet-fsa.go.jp/searchdocument/pdf/S100IS9D.pdf,N/A,The Group is raising funds by issuing stocks and corporate bonds in addition to borrowing from banks.
269,614,しかしながら、今後、金融市場が混乱した場合、税制改正や政府系金融機関の制度変更等がなされた場合、もしくは当社グループの信用格付けが引き下げられた場合等においては、資金調達コストの増加や必要とする金額の資金調達が困難となること等により、当社グループの経営成績と財政状態に悪影響を及ぼす可能性があります。,https://disclosure2dl.edinet-fsa.go.jp/searchdocument/pdf/S100IS9D.pdf,N/A,"However, in the future, if the financial market is confused, if the tax reform or the government -based financial institution system has been changed, or if the credit rating of the Group is reduced, the funding cost is increased or necessary. Due to the difficulty of financing the amount, it may adversely affect the business performance and financial status of the Group."
270,615,また、当社グループの有利子負債には金利変動の影響を受けるものが含まれており、金利上昇により金融コストが上昇した場合には、当社グループの経営成績と財政状態に悪影響を及ぼす可能性があります。,https://disclosure2dl.edinet-fsa.go.jp/searchdocument/pdf/S100IS9D.pdf,N/A,"In addition, the Group's interest -bearing debt is affected by interest rate fluctuations, and if financial costs increase due to an increase in interest rates, it may adversely affect the business performance and financial status of the Group. 。"
271,616,なお、当社グループの財務内容の悪化が一部借入金等の財務制限条項に抵触し、期限の利益を喪失することとなった場合には、当社グループの経営成績と財政状態に悪影響を及ぼす可能性があります。,https://disclosure2dl.edinet-fsa.go.jp/searchdocument/pdf/S100IS9D.pdf,N/A,"In addition, if the deterioration of the Financial content of the Group conflicts with the financial restriction clause such as borrowings, the possibility of adversely affect the management performance and financial status of the Group. there is."
272,617,当社グループは、商品の開発、生産、販売に関し、技術提携や合弁等の形で、他社と共同活動を実施、もしくは検討を行っています。,https://disclosure2dl.edinet-fsa.go.jp/searchdocument/pdf/S100IS9D.pdf,N/A,"The Group has been conducting or studying with other companies in the form of technical alliance and joint ventures regarding product development, production, and sales."
273,618,これにより経営資源の最適化、集中化及び相乗効果を期待しています。,https://disclosure2dl.edinet-fsa.go.jp/searchdocument/pdf/S100IS9D.pdf,N/A,"This is expected to optimize management resources, intensive and synergistic effects."
274,619,しかしながら、経営、財務またはその他の理由により当事者間で不一致が生じた場合、あるいは、提携や合弁の変更または解消等により、期待される結果を生まなかった場合には、当社グループの経営成績と財政状態に悪影響を及ぼす可能性があります。,https://disclosure2dl.edinet-fsa.go.jp/searchdocument/pdf/S100IS9D.pdf,N/A,"However, if the parties are inconsistent for business, financial, or other reasons, or if there is no expected result due to changes or resolution of partnerships, joint ventures, etc., the Group's business performance and finance. It may have a negative effect on the state."
275,620,また、意図しない提携や合弁の変更または解消が、当社グループの経営成績と財政状態に悪影響を及ぼす可能性があります。,https://disclosure2dl.edinet-fsa.go.jp/searchdocument/pdf/S100IS9D.pdf,N/A,"In addition, unintended partnerships and joint ventures may adversely affect the management performance and financial status of the Group."
276,621,当社グループが製品を販売している世界各地域の自動車市場においては、多様な競合相手が存在しています。,https://disclosure2dl.edinet-fsa.go.jp/searchdocument/pdf/S100IS9D.pdf,N/A,"In the car market in various regions where the Group sells products, there are various competitors."
277,622,ブランド価値の維持発展を含む市場での競争力の維持強化は当社グループの成長にとって非常に重要であり、そのために開発・製造・販売等において競争力の強化に向けた取り組みを進めています。,https://disclosure2dl.edinet-fsa.go.jp/searchdocument/pdf/S100IS9D.pdf,N/A,"Strengthening competitiveness in markets, including brand value maintenance and development, is very important for the growth of the Company, and we are working to strengthen competitiveness in development, manufacturing, and sales."
278,623,しかしながら、市場の予測が十分でなかった場合、あるいは技術力や生産上の問題等により、魅力ある製品を適切な時期に投入することが出来なかった場合、あるいはお客さまの価値観または変化に対応した流通網、販売手法を効果的に展開できなかった場合、販売シェアの低下や製品価格の低下を含め、当社グループの経営成績と財政状態に悪影響を及ぼす可能性があります。,https://disclosure2dl.edinet-fsa.go.jp/searchdocument/pdf/S100IS9D.pdf,N/A,"However, if the market is not predicted, or if attractive products cannot be introduced at the right time due to technical and production problems, or responding to customer values ​​or changes. If the distribution network or sales method cannot be developed effectively, it may adversely affect the business performance and financial status of the Group, including a decrease in sales share and product prices."
279,624,当社グループは、事業の優位性を確保するために他社製品と区別化できる技術とノウハウの蓄積、それらの保護並びに、第三者の知的財産権に対する侵害予防に努めています。,https://disclosure2dl.edinet-fsa.go.jp/searchdocument/pdf/S100IS9D.pdf,N/A,"The Group is striving to ensure the superiority of the business, the accumulation of technologies and know -how that can be distinguished from other companies' products, the protection of their third parties, and the infringement of third -party intellectual property rights."
280,625,それにもかかわらず、認識または見解相違により、第三者からその知的財産権を侵害したとして訴訟を受け、当社グループとして製造販売中止、あるいは損害賠償などが必要となった場合には、当社グループの経営成績と財政状態に悪影響を及ぼす可能性があります。,https://disclosure2dl.edinet-fsa.go.jp/searchdocument/pdf/S100IS9D.pdf,N/A,"Nevertheless, if a lawsuit is subject to a lawsuit for infringing its intellectual property rights due to recognition or a different view of the view, and the group is required to discontinue and sell or damages, the Group will be required. It may adversely affect the business performance and financial status of."
281,626,また、特定の地域では当社グループの知的財産権が完全に保護されない場合があります。,https://disclosure2dl.edinet-fsa.go.jp/searchdocument/pdf/S100IS9D.pdf,N/A,"Also, in specific areas, the intellectual property rights of the Group may not be completely protected."
282,627,第三者が当社グループの知的財産権を無断使用して類似した製品を製造した場合、多額の訴訟費用のみならず製品区別化が図れないことによる販売減少により、当社グループの経営成績と財政状態に悪影響を及ぼす可能性があります。,https://disclosure2dl.edinet-fsa.go.jp/searchdocument/pdf/S100IS9D.pdf,N/A,"If a third party manufactures similar products without permission from the Group's intellectual property rights, not only a large amount of lawsuit expenses but also the decrease in sales due to the fact that product wards cannot be separated will be reduced, and our Group's business performance and finances. It may have a negative effect on the state."
283,630,当社グループは、製品の開発、生産、販売など、様々なビジネス活動の遂行において、情報技術やネットワーク、システムを利用しています。,https://disclosure2dl.edinet-fsa.go.jp/searchdocument/pdf/S100IS9D.pdf,N/A,"The Group uses information technology, networks, and systems in performing various business activities, such as product development, production, and sales."
284,631,また、当社製品にも、運転支援システムなど、これら技術を採用した装備が搭載されています。,https://disclosure2dl.edinet-fsa.go.jp/searchdocument/pdf/S100IS9D.pdf,N/A,"In addition, our products are equipped with equipment that adopt these technologies, such as driving support systems."
285,637,当社グループは、昨年11月、新たな中期経営計画（2020年３月期～2025年３月期）を公表いたしました。,https://disclosure2dl.edinet-fsa.go.jp/searchdocument/pdf/S100IS9D.pdf,N/A,The Group announced a new medium -term management plan (March 2020 -March 2025) last November.
286,638,各種施策等の実行にあたっては、想定とは大きく異なる環境変化の発生や、計画どおりに進捗しない場合など、期待される効果が実現しないことにより、当社グループの経営成績と財政状態に悪影響を及ぼす可能性があります。,https://disclosure2dl.edinet-fsa.go.jp/searchdocument/pdf/S100IS9D.pdf,N/A,"In executing various measures, etc., it is possible to adversely affect the management performance and financial status of the Group because the expected effects are not realized, such as the occurrence of environmental changes that are significantly different from expected or if they do not progress as planned. I have sex."
287,639,当社グループは、2017年に、2030年を見据えた技術開発の長期ビジョン「サステイナブル“Zoom-Zoom”宣言2030」を策定しました。,https://disclosure2dl.edinet-fsa.go.jp/searchdocument/pdf/S100IS9D.pdf,Neutral,"In 2017, the Group has formulated a long-term vision of technology development in 2030, ""Sustainable"" Zoom-Zoom ""Declaration 2030."
288,640,これは世界の自動車産業を取り巻く環境の急激な変化を踏まえ、より長期的な視野に立ち、クルマの持つ魅力である「走る歓び」によって、「地球」、「社会」、「人」それぞれの課題解決を目指す新しいチャレンジとなる取り組みです。,https://disclosure2dl.edinet-fsa.go.jp/searchdocument/pdf/S100IS9D.pdf,Neutral,"This is a more long -term perspective, based on the rapid change of the environment surrounding the world's automotive industry, and the ""running joy"" of the car has a ""global"", ""society"", and ""people"". It is a new challenge to solve it."
