,pk,URL,news_headline,impact_type,translated
0,2236,https://esg.businesstoday.com.tw/article/category/180687/post/202210180007,讓剩食成為「驚喜包」！新創Foodsi如何從500萬噸食物浪費，找到重生商機？,0,"Let the leftovers become a ""surprise package""! How does Xinchuang FoodSi waste from 5 million tons of food and find rebuilding business opportunities?"
1,506,https://esg.businesstoday.com.tw/article/category/180688/post/202011110040,傳統學制崩解？未來教育已成形,3,The traditional academic system collapse? Future education has taken shape
2,184,https://esg.businesstoday.com.tw/article/category/180687/post/201912160029,不購物的一年！減少衣服的「3個要領」，你只需要一個筆記本,4,"One year without shopping! Reduce the ""three essentials"" of clothes, you only need one notebook"
3,1005,https://esg.businesstoday.com.tw/article/category/180687/post/202108240045,中鋼汽電共生鍋爐 全面停用燃煤發電,0,Sinosteel Steel Electric Symbiosis Boiler fulfills coal -fired power generation
4,235,https://esg.businesstoday.com.tw/article/category/180687/post/202005040008,一晚要價五千元照樣預約一空　勤美如何翻轉老樂園成全台最夯野宿體驗？,0,"How to make an appointment for 5,000 yuan in one night, how can I turn the old paradise to turn the old paradise into Taiwan's most rammed hobby experience?"
5,572,https://esg.businesstoday.com.tw/article/category/180687/post/202012210026,訂餐介面多一個功能！foodpanda企業責任目標：2021年垃圾減量1500萬公斤,0,"One function of ordering interface! FOODPANDA Enterprise Responsibility Objective: In 2021, garbage minus 15 million kg"
6,1593,https://esg.businesstoday.com.tw/article/category/180687/post/202203040001,跟著碳盤查資訊永續投資！排碳大戶分四階段全都露,3,Follow the carbon disk to investigate the information permanent investment! The carbon discharge households are all exposed in four stages
7,274,https://esg.businesstoday.com.tw/article/category/180687/post/202006240012,永續新思維　如何掌握後疫時代的綠色振興,3,How to master the green revitalization of the post -epidemic era
8,1789,https://esg.businesstoday.com.tw/article/category/190807/post/202204270062,五年減排560萬噸碳！國發會通過資源循環計畫，目標2027年前減1.25億個一次性用品,3,"5.6 million tons of carbon reduction in five years! The National Development Council passed the resource cycle plan, and the target reduced 125 million disposable supplies by 2027"
9,1592,https://esg.businesstoday.com.tw/article/category/180687/post/202203040013,50元就能買到雞腿便當？Tasteme怎麼把棘手的「剩食」問題變成一門好生意,0,"Can you buy chicken leg bento in 50 yuan? How does TASTEME turn the difficult ""leftovers"" problem into a good business?"
10,381,https://esg.businesstoday.com.tw/article/category/180688/post/202009220029,如何與孩子談性？陶晶瑩的性愛自修室　父母要先知道自己性教育拿幾分,4,How to talk to children? Tao Jingying's sex self -cultivated parents must first know how to get sex education for a few points
11,1604,https://esg.businesstoday.com.tw/article/category/180689/post/202202100021,一杯咖啡決定創業！陽光伏特家創辦人陳惠萍：人不該因性別而侷限自己人生的選擇,0,"A cup of coffee decides to start a business! Chen Huiping, founder of Sunshine Volt Family: People should not limit their choice of life due to gender"
12,606,https://esg.businesstoday.com.tw/article/category/180687/post/202101060030,拚太陽光電進度達標》沈榮津：政府推漁電共生　這4管齊下,3,"Fighting Sun Optoelectronics Metro Standard ""Shen Rongjin: The government's 4 tube of the coexistence of fishing and electricity in the government"
13,2259,https://esg.businesstoday.com.tw/article/category/180687/post/202210260018,地球上所有生命的生存保衛戰！氣候變遷有哪些解決方案？您不可不知的十大關鍵方法,3,All life and defense war on the earth! What are the solutions for climate change? The top ten key methods you must know
14,1186,https://esg.businesstoday.com.tw/article/category/180687/post/202110290005,「以每噸3美元而言，全球碳價仍然太低」！富達國際投資長：加速減碳，成敗就看COP26,3,"""In terms of $ 3 per ton, global carbon prices are still too low!"" Fidelity International Investment: Accelerate carbon reduction, the success or failure depends on COP26"
15,2005,https://esg.businesstoday.com.tw/article/category/180688/post/202207180031,科技重塑金融服務樣貌 玉山擁抱科技 打造健康有韌性的組織,0,Science and technology reshape financial services. Yushan embraces technology to create a healthy and tough organization
16,1165,https://esg.businesstoday.com.tw/article/category/180687/post/202110250021,台達50週年大秀綠色實力！3500人參與的音樂會如何達到零碳目標？,0,"Taida's 50th anniversary show green strength! How can 3,500 people participate in zero carbon target?"
17,554,https://esg.businesstoday.com.tw/article/category/180688/post/202012100011,最強館長棄百萬年薪！ 砸千萬退休金只為做「這件事」！,3,"The strongest museum has abandoned millions of annual salary! Smaller pensions are just to do ""this matter""!"
18,1313,https://esg.businesstoday.com.tw/article/category/180688/post/202112010002,損失近 4 億營收！化妝品品牌 LUSH 為何一口氣關了臉書、IG、TikTok等社群平台？,1,"Loss nearly 400 million revenue! Why did the cosmetic brand LUSH turn off the social platforms such as Facebook, IG, TIKTOK?"
19,875,https://esg.businesstoday.com.tw/article/category/180687/post/202107050040,台泥股東會通過配息3.5元，董座張安平：全力轉型綠色企業,0,"Taibu's shareholders will pass the dividend of 3.5 yuan, Dong Zhenping Zhang Anping: fully transforming green enterprises"
20,2309,https://esg.businesstoday.com.tw/article/category/180688/post/202211090053,每瓶鮮乳都能公平賣出、讓供應商獲得合理報酬... 鮮乳坊如何靠「超透明」年營收6億,0,"Each bottle of fresh milk can be sold fairly, so that the supplier gets reasonable remuneration ... How does fresh milk workshop rely on ""ultra -transparent"" annual revenue of 600 million"
21,397,https://esg.businesstoday.com.tw/article/category/180687/post/202009260025,別以為做ESG就是行善而已...一則寓言故事看懂：永續經營的真正含意,3,Don't think that doing ESG is just doing good ... A fable story understands: the true meaning of sustainable operation
22,1946,https://esg.businesstoday.com.tw/article/category/190807/post/202206300039,「恢復‧再出發」迎向疫後 回歸日常 花旗全球義工日號召員工減塑、清消輪椅 關懷身障者心理健康,0,"""Restore ‧ Starting"" welcomes the return of daily Citi Global Volunteer Day calling on employees to reduce plasticity and clear up wheelchair to care for the mental health"
23,1106,https://esg.businesstoday.com.tw/article/category/190807/post/202110050025,2021世界環境清潔日Be Cool！讓地球降溫吧！,3,2021 World Environment Clean Day be cool! Let the earth cool down!
24,31,https://esg.businesstoday.com.tw/article/category/180688/post/201803070007,創造可以共享的價值,3,Create the value that can be shared
25,183,https://esg.businesstoday.com.tw/article/category/180687/post/201912120035,瑞典少女為氣候變遷發聲，獲選時代雜誌年度風雲人物　卻因「這原因」引發爭議,3,"Swedish girls spoke for climate change, and the annual character of the selected era magazine caused controversy for ""reason"""
26,465,https://esg.businesstoday.com.tw/article/category/180687/post/202010210063,企業減碳　提升綠色競爭力,3,Enterprise carbon reduction enhances green competitiveness
27,2048,https://esg.businesstoday.com.tw/article/category/190807/post/202208100051,花旗攜台灣綠能公益發展協會、陽光伏特家，創造國內首例公益碳權,0,Citi bring Taiwan Green Energy Public Welfare Development Association and Sunshine Volt House to create the first domestic public welfare carbon rights
28,1245,https://esg.businesstoday.com.tw/article/category/180689/post/202111110047,老公司搏轉型！沉默50年的大同寶寶會說話，幕後推手竟是他...,0,"The old company rotates! Datong, who was silent for 50 years, would speak, and it was him behind the scenes ..."
29,717,https://esg.businesstoday.com.tw/article/category/180687/post/202103160039,福島核災10年了...前首相菅直人告白：核電真的便宜到需要國民賭命嗎？,3,For 10 years for Fukushima nuclear disaster ... Former Prime Minister Naoto Naoto Confession: Nuclear power is really cheap enough to need national gambling?
30,2415,https://esg.businesstoday.com.tw/article/category/190807/post/202212080009,你有感嗎？吃什麼都好貴！餐廳單價大漲二成，解封後將迎接「吃不起的年代」,3,Do you feel? It's expensive to eat anything! The unit price of the restaurant has risen by 20 %.
31,2079,https://esg.businesstoday.com.tw/article/category/180688/post/202208220020,耗時8年研發！JR東海啟動最新混合式特急列車，大幅削減3成碳排,0,"It takes 8 years to develop! JR East China Sea launched the latest hybrid special emergency train, which greatly reduced 30 % carbon row"
32,132,https://esg.businesstoday.com.tw/article/category/180687/post/201906120007,處變不驚的「碳」為觀止,3,"The ""carbon"" that is not shocked is obsessed"
33,1109,https://esg.businesstoday.com.tw/article/category/180687/post/202110050032,什麼是碳中和、淨零碳排？一次看懂全球環保趨勢：碳中和是永續發展關鍵,3,What is carbon neutralization and net zero carbon row? Understand the global environmental trend once: carbon neutrality is the key to sustainable development
34,1886,https://esg.businesstoday.com.tw/article/category/190807/post/202206020050,台新金、新光金「兄弟準備山頂會合」？合併可能玩真的！台新成立合併研究小組進行評估,2,"Taishinjin and Xinguangjin ""Brothers are preparing for the top of the mountain""? The merger may play real! Taishin's establishment of a consolidated research team for evaluation"
35,2272,https://esg.businesstoday.com.tw/article/category/190807/post/202210250029,7-11咖啡限時一週免費喝！找出家中寶特瓶、廢電池來換，CITY CAFE拿鐵、美式就送你,0,7-11 Coffee for a week for a week for free! Find out the treasure bottle and waste battery in the family to change it.
36,2400,https://esg.businesstoday.com.tw/article/category/180689/post/202212020028,漂綠是門好生意？破解12項可能手法，避免成為企業漂綠幫兇,3,River green is a good business? Crack the 12 possible techniques to avoid becoming a corporate drifting.
37,610,https://esg.businesstoday.com.tw/article/category/180687/post/202101080025,9成台灣人有回收習慣，卻有4成資源被丟掉！圖解101種常見垃圾,3,"90 % of Taiwanese have the habit of recycling, but 40 % of resources have been lost! Illustration 101 common garbage"
38,2423,https://esg.businesstoday.com.tw/article/category/190807/post/202212130011,首波冷氣團就直衝「寒流」等級！週末全台急凍最低探4℃，一圖看懂各地低溫...這天才會回暖,3,"The first wave of air -conditioned groups went straight to the ""cold current"" level! The minimum frozen in Taiwan on weekends is 4 ° C. One picture understands the low temperature in various places ... this day will be heated back on this day"
39,55,https://esg.businesstoday.com.tw/article/category/180687/post/201808010027,通路商攜手小農  打造食物信任度,3,Tongtong merchants join hands with small farmers to build food trust
40,272,https://esg.businesstoday.com.tw/article/category/180687/post/202006230060,破除GDP迷思的 7 個思考！解讀《甜甜圈經濟學》,3,"Seven thoughts to break the GDP myth! Interpret ""Glose Economics"""
41,137,https://esg.businesstoday.com.tw/article/category/180689/post/201907170010,為何行善有助永續經營？,3,Why do good help to continue to operate forever?
42,2425,https://esg.businesstoday.com.tw/article/category/180687/post/202212130023,洗手液不裝在塑膠瓶販售，要如何送到消費者手上？倫敦包裝設計師：減少浪費是我的首要任務,0,Do not install it in a plastic bottle for sale. How can I send it to consumers? London packaging designer: reducing waste is my primary task
43,1805,https://esg.businesstoday.com.tw/article/category/180687/post/202205050010,份量越多越好？「減少食物浪費」成消費新主張，餐廳如何做到永續？,2,"The more the portion, the better? ""Reducing food waste"" has become a new proposition of consumption."
44,1390,https://esg.businesstoday.com.tw/article/category/180688/post/202112200013,玉山金控長期支持醫療發展 一起守護健康！,0,Yushan Golden Control has long supported medical development to guard health together!
45,696,https://esg.businesstoday.com.tw/article/category/180687/post/202103080052,為何循環經濟能細水長流，卻不利短期財務數字？永續發展的5大商模,3,"Why can the circular economy be fine and long, but it is not good for short -term financial figures? Five major business models of sustainable development"
46,1290,https://esg.businesstoday.com.tw/article/category/190807/post/202111240007,不捨！推動全球ESG發展、將永續觀點帶進台灣，今周刊專欄作者林羿成車禍過世,3,"Don't give up! Promote the development of global ESG and bring sustainable views into Taiwan, Lin Yi, the author of this weekly column, died in a car accident."
47,1139,https://esg.businesstoday.com.tw/article/category/180687/post/202110140009,氣候變遷危機》受不了高溫！幼鳥紛紛跳出鳥巢，導致大量鳥類死亡,3,"""Climate Change Crisis"" cannot stand high temperature! Young birds jumped out of the bird's nest, causing a large number of birds to die"
48,867,https://esg.businesstoday.com.tw/article/category/180688/post/202106280009,整理包》疫苗殘劑開放18歲以上候補接種，各縣市規畫預約方式,4,"Organization package ""Vaccine residue is open for vaccination 18 years old, counties and cities planning and appointment methods"
49,2380,https://esg.businesstoday.com.tw/article/category/180687/post/202211250011,耗時 9 年只為打造 100% 可回收瓶蓋！番茄醬龍頭品牌挑戰永續新包裝,0,It takes 9 years to create a 100% recyclable bottle cap! Tomato sauce leading brand challenge new packaging
50,765,https://esg.businesstoday.com.tw/article/category/180687/post/202104140064,盜獵難解，原住民文化背黑鍋？生態永續、動物福利大辯論：界線何在？,3,"Sherry is difficult to solve, the aboriginal culture back black pot? Ecological sustainability, animal welfare debate: What is the boundary?"
51,685,https://esg.businesstoday.com.tw/article/category/190807/post/202103040018,聯電深耕ESG有成！公司治理評鑑排名前5％、連續13年入選DJSI,0,"UMC deeply cultivated ESG! The top 5 % of the company's governance evaluation ranking, selected into DJSI for 13 consecutive years"
52,1161,https://esg.businesstoday.com.tw/article/category/180687/post/202110210012,碳足跡定義是什麼？看懂碳足跡標籤才能真正綠色消費,3,What is the definition of carbon footprints? Understand carbon footprint labels to truly green consumption
53,1911,https://esg.businesstoday.com.tw/article/category/180689/post/202206200014,全球供應鏈 25 強出爐！輝瑞、AZ 藥廠進榜，ESG 成為供應鏈關鍵競爭力？,3,"The top 25 global supply chain is released! Pfizer and AZ Pharmaceuticals entered the list, ESG became the key competitiveness of the supply chain?"
54,353,https://esg.businesstoday.com.tw/article/category/180687/post/202009110023,「別人的廢棄物可能是我們的資源」  Dell如何讓海洋塑膠、擋風玻璃從垃圾變黃金？,0,"""Other people's waste may be our resources."" How does Dell make marine plastic and windshields from garbage?"
55,228,https://esg.businesstoday.com.tw/article/category/180687/post/202004200019,小朋友們戴著口罩撿垃圾...謝金河：淨灘是我見過最美好的畫面！,3,Children wearing a cover to pick up garbage ... Xie Jinhe: Jingtan is the best picture I have ever seen!
56,825,https://esg.businesstoday.com.tw/article/category/180688/post/202105200018,迎接綠色金融浪潮　玉山聚焦「永續金融人才」佈局,0,"Welcome to the green financial wave Yushan to focus on the layout of ""sustainable financial talents"""
57,333,https://esg.businesstoday.com.tw/article/category/180688/post/202008280019,同事們還在工作，你敢準時下班嗎？責任制不是老闆說了算！,3,"The colleagues are still working, do you dare to get off work on time? The responsibility system is not the boss!"
58,955,https://esg.businesstoday.com.tw/article/category/180687/post/202108050031,三大原因，告訴你為何臺灣不適合核能發電,3,"Three reasons, tell you why Taiwan is not suitable for nuclear power generation"
59,2097,https://esg.businesstoday.com.tw/article/category/190807/post/202208270015,紙杯新概念，開啟全紙回收時代！中華紙漿，以技術翻轉用紙趨勢,0,"New concept of paper cups, open the era of full paper recycling! Chinese pulp, the trend of paper with technical flip"
60,1003,https://esg.businesstoday.com.tw/article/category/180688/post/202108240044,涂醒哲：大家誤會了！郭董沒有「買」新冠疫苗,4,"Tu Xingzhe: Everyone misunderstood! Guo Dong did not ""buy"" new crown vaccine"
61,352,https://esg.businesstoday.com.tw/article/category/180687/post/202009100019,一雙賣到6千塊的海洋廢棄塑料鞋，背後功臣竟是台灣！一文解析，台灣如何再創「紡織奇蹟」,3,"A pair of marine waste plastic shoes sold for 6,000 yuan, the hero behind it is Taiwan! Analysis of one article, how does Taiwan create a ""textile miracle"""
62,721,https://esg.businesstoday.com.tw/article/category/180687/post/202103170021,石油居然比汽水還便宜！比爾蓋茲：氣候變遷比新冠病毒致命5倍,3,Petroleum is actually cheaper than soda! Bill Gates: Climate change is 5 times fatal than the new crown virus
63,1560,https://esg.businesstoday.com.tw/article/category/180689/post/202202230028,為何德國賓士捧30億入股這家台灣電池廠？ 契機竟是2014年這款宏達電產品,0,Why does Germany hold 3 billion to this Taiwan battery factory? The opportunity is this Hongda Electric product in 2014
64,322,https://esg.businesstoday.com.tw/article/category/180687/post/202008200028,塑膠也能變電池！美最新研究「廢棄物儲能裝置」，讓寶特瓶、光碟有更好的再生方式,3,"Plastic can also change batteries! The latest American research ""waste energy storage device"" allows Baotter bottle and discs to have a better way to regenerate"
65,1278,https://esg.businesstoday.com.tw/article/category/180689/post/202111220021,遠東集團遭陸重罰！遠東新證實：9成已改善，很多企業都受檢遭罰、納悶為何遭點名,1,"Far East Group was severely punished! Far East New confirmation: 90 % have improved, and many companies have been punished and wondered why they were named"
66,831,https://esg.businesstoday.com.tw/article/category/180687/post/202105260055,缺水缺電、疫情升溫...彭博：台灣面臨氣候脆弱帶來的挑戰,3,"Water deficiency and electricity, the epidemic warming ... Bloomberg: Taiwan faces the challenge brought by the fragile climate"
67,1311,https://esg.businesstoday.com.tw/article/category/180687/post/202111300008,什麼是「碳邊境調整機制」？ 排碳者付費當道！看懂歐盟碳關稅的全球影響,3,"What is the ""carbon border adjustment mechanism""? Carbonaters pay for it! Understand the global impact of EU carbon tariffs"
68,542,https://esg.businesstoday.com.tw/article/category/180687/post/202012040017,荒廢老屋＋熱血年輕人！2個小鄉鎮創生故事：看這群台灣「擦澡工」如何以修代租，讓老房子再現風華,3,"Wilderly old house + bloody young people! Two small township creative stories: See how this group of Taiwan ""bath workers"" can be rented to rents, so that the old house reproduces the wind and Chinese"
69,794,https://esg.businesstoday.com.tw/article/category/180687/post/202104270036,停水、限水怎麼辦？缺水期3步驟正確用水，從儲水到復水都有訣竅,3,"What should I do if I do n’t stop water and limit water? 3 steps for 3 steps in the water shortage period, there is a trick from storage to re -water"
70,1262,https://esg.businesstoday.com.tw/article/category/180688/post/202111170040,挖掘在地職人、支持身障者就業！台灣這家B型企業推「吃好食、做公益」，讓每塊錢都發揮影響力,0,"Digging in local staff and supporting the disabled employment! This B -type enterprise in Taiwan has pushed ""eating good food, doing public welfare"", so that each dollar can exert its influence"
71,924,https://esg.businesstoday.com.tw/article/category/180687/post/202107280011,減碳不只是環保議題！讓產業轉骨，台灣應明確建立「碳定價制度」,3,"Carbon reduction is not just an issue of environmental protection! To make the industry bone, Taiwan should clearly establish the ""carbon setting system"""
72,2373,https://esg.businesstoday.com.tw/article/category/180688/post/202211240013,一瓶水救地球！解渴變容易，奉茶App讓旅人簡單找水，「從小行動改變，就能產生巨大影響力」,0,A bottle of water to save the earth! Quite quenching is easy. Fengcha APP allows travelers to find water simply.
73,741,https://esg.businesstoday.com.tw/article/category/180687/post/202103290028,聯合再生減資4成補虧損！跨進太陽能電廠，力拚建置1GW、電費收入55億元,0,"United regeneration reduction of 40 % to make up for losses! Step into the solar power plant, build 1GW and electricity costs of 5.5 billion yuan"
74,2355,https://esg.businesstoday.com.tw/article/category/180687/post/202211180013,COP27現場直擊》能源轉型也能穩定供電嗎？西、美、台各分享島嶼經驗,3,"Can COP27 directly hit the energy transformation? West, the United States, and Taiwan share the experience of islands"
75,1746,https://esg.businesstoday.com.tw/article/category/180687/post/202204150006,登IPCC國際報告！成大「綠色魔法學校」並列全球七大指標性綠建築,3,"Login IPCC International Report! Chengda ""Green Magic School"" is tied for seven indicator of green buildings in the world"
76,1459,https://esg.businesstoday.com.tw/article/category/180688/post/202201130030,終結血腥！時尚大國義大利將關閉最後十家皮草場,3,End blood! Fashion country Italy will close the last ten fur farms
77,1372,https://esg.businesstoday.com.tw/article/category/180687/post/202112160002,氣候升溫控制在1.5°C以下，全球碳價格恐升至600～800美元！碳價怎麼訂？牛津採NGFS模型,3,"The climate heating is controlled below 1.5 ° C, and the global carbon prices are likely to rise to $ 600 to $ 800! How to order carbon prices? Oxford's NGFS model"
78,1087,https://esg.businesstoday.com.tw/article/category/180689/post/202109290050,沒念大學、二度創業失敗，他憑什麼擠下軟銀孫正義、Uniqlo柳井正？日本神秘「新首富」，靠2心法擁破兆身家,0,"Without studying university, he failed to start a business for two times. Japan's mysterious ""new richest man"", relied on 2 mental methods to break the Zhaoda"
79,647,https://esg.businesstoday.com.tw/article/category/190807/post/202102020034,結合本業實踐CSR  邁向ESG永續經營,0,Combined with the practice of this industry CSR to ESG Sustainable Management
80,2086,https://esg.businesstoday.com.tw/article/category/180687/post/202208240024,「吸碳成石」是門好生意！貝佐斯、比爾蓋茲都看好，這家新創如何革新水泥製造過程？,0,"""Carbon absorption"" is a good business! Bezos and Bill Gates are optimistic. How does this new creation make a new cement manufacturing process?"
81,49,https://esg.businesstoday.com.tw/article/category/180687/post/201805300028,全台唯一！離岸風機八成海底探測都靠它,4,The only one in Taiwan! 80 % of the offshore wind turbine depends on it
82,1522,https://esg.businesstoday.com.tw/article/category/180687/post/202202080013,你能想像「苦瓜可樂」、「鹹蛋啤酒」的滋味嗎？這間公司發明「飲料印表機」，讓飲料隨選隨喝！,0,"Can you imagine the taste of ""bitter gourd"" and ""salted egg beer""? This company invented the ""beverage printer"", allowing drinks to drink with them!"
83,1317,https://esg.businesstoday.com.tw/article/category/190807/post/202112010075,年關前爆倒閉！英業達子公司負債22億無法償還，聲請破產,1,"Outside of the year's closure! The debt of Yingya subsidiaries cannot be repaid by 2.2 billion, and the voice is bankrupt"
84,336,https://esg.businesstoday.com.tw/article/category/180689/post/202007160010,區域主要投資機構　歐銀援助區域橫跨歐、亞、非三大洲　鎖定綠色產業趨勢,0,"Regional major investment institutions European and silver aid areas across Europe, Asia, and Africa to lock the green industry trend"
