,pk,URL,news_headline,impact_type,translated
187,2078,https://esg.businesstoday.com.tw/article/category/180689/post/202208220038,越南向台灣半導體、電池廠招手　土地租金15年零元可以談！ 為何越南電動車最大咖想找台廠？,0,Vietnam can be talked about to Taiwan semiconductor and battery factory for 15 years! Why do you want to find a Taiwan factory in Vietnam's biggest coffee?
188,27,https://esg.businesstoday.com.tw/article/category/180687/post/201802070018,邁向2035 循環台灣,3,Towards 2035 cycle Taiwan
189,836,https://esg.businesstoday.com.tw/article/category/180687/post/202106020046,病例要清零，碳排也要！3000家醫療院所加入聯合國「零碳競逐」,3,"Cases should be cleared, and carbon rows must also be! 3,000 medical institutions joined the United Nations ""zero carbon competition"""
190,639,https://esg.businesstoday.com.tw/article/category/180687/post/202101280034,優等生也抗拒過ESG？台積電如何用10年時間，打造超越美、韓的綠色製造,0,Premium students have also resisted ESG? How to use TSMC for 10 years to create green manufacturing beyond the United States and South Korea
191,786,https://esg.businesstoday.com.tw/article/category/180687/post/202104220013,2021環境金害獎》點名國內五大污染公司，中油三度上榜，堪稱「污染霸主」,3,"2021 Environmental Gold Vimproach Award ""named the five major domestic pollution companies, and the oil was on the list three times."
192,1432,https://esg.businesstoday.com.tw/article/category/180688/post/202201060005,鮮乳坊4階段進攻全家咖啡龐大商機！全年營收6億元，未來還可以怎麼走？,0,"Fresh milk workshop 4 stages to attack the huge business opportunities of the whole family coffee! The annual revenue is 600 million yuan, how can I go in the future?"
193,1166,https://esg.businesstoday.com.tw/article/category/180689/post/202110250044,台泥超級電池工廠高雄動工！張安平：打造從電池、儲能、綠能一條龍的產業鏈,0,"Kaohsiung at TSM's super battery factory starts! Zhang Anping: Create an industrial chain from battery, energy storage, and green energy."
194,23,https://esg.businesstoday.com.tw/article/category/180688/post/201801170005,式微的商業道德標準,3,Micro -micro business ethics standard
195,1382,https://esg.businesstoday.com.tw/article/category/190807/post/202112220004,ESG+現場1》苗栗 大湖 台灣房屋的一萬棵樹,0,"ESG+Live 1 ""Miaoli Dahu Taiwan houses in Taiwan's houses"
196,20,https://esg.businesstoday.com.tw/article/category/180688/post/201801100035,十大傑出青年：台灣人把移工當奴隸,3,Top Ten Outstanding Young Man: Taiwanese people take migrant workers as slaves
197,1917,https://esg.businesstoday.com.tw/article/category/180689/post/202206200012,90 歲樂高仍保有「赤子之心」，持續創新的路上做了哪些事？,0,"At the age of 90, Lego still retains the ""Heart of Chizi"". What do you do on the road of continuous innovation?"
198,730,https://esg.businesstoday.com.tw/article/category/180687/post/202103240044,銘安靠塑膠分解技術讓星巴克、好市多、蘋果都指名！環保就是浪漫，他用一根吸管征服國際,0,"Ming'an rely on plastic decomposition technology to make Starbucks, Hao City, and Apple all named! Environmental protection is romance, he uses a straw to conquer the international"
199,833,https://esg.businesstoday.com.tw/article/category/180687/post/202105260037,永續海洋環境　彰化縣政府攜手地方守護海洋資源,3,Sustainable marine environment Changhua County Government and local governments to protect marine resources
200,1943,https://esg.businesstoday.com.tw/article/category/190807/post/202206300025,德國主場G7峰會動員千億美元投資開發中國家，規劃氣候基礎建設,3,The German home G7 Summit mobilizes the US $ 100 billion to invest and develop a country to plan climate infrastructure construction
201,2146,https://esg.businesstoday.com.tw/article/category/180689/post/202209140037,台積毛利率破5成，這家保健品代工廠竟達7成！娘家紅麴、滴雞精年銷12億，民視背後軍火庫曝光,0,"TSMC's gross profit margin exceeded 50 %, and this health product foundry reached 70 %! The maid's red cricket and drip chicken sold for 1.2 billion years, and the arsenal behind the civil TV was exposed"
202,638,https://esg.businesstoday.com.tw/article/category/180687/post/202101270052,長榮海運曾被挪威主權基金列黑名單，它如何成功「洗白」重獲青睞？,0,Evergreen Haiyun has been blacklisted by the Norwegian sovereign fund.
203,636,https://esg.businesstoday.com.tw/article/category/180687/post/202101280022,「誰殺了野生動物？」熱血獸醫為動物請命，成立「東部唯一」野生動物醫院：願遺憾不再,3,"""Who killed wild animals?"" The blood veterinarians asked for animals to set up ""the only"" wild animal hospital in the east: I would like to regret not"
204,1798,https://esg.businesstoday.com.tw/article/category/180688/post/202204290010,「20億退休金」群創提前發放！近5400名員工「擁這條件」就能先領回、續留公司打拼,0,"The ""2 billion pension"" group creation was distributed in advance! Nearly 5,400 employees ""have this condition"" can get back and renew the company to work hard"
205,46,https://esg.businesstoday.com.tw/article/category/180689/post/201805160020,B型企業認證的背後意義,3,The meaning of the B -type enterprise certification
206,911,https://esg.businesstoday.com.tw/article/category/190807/post/202107230037,賓士目標2030年前全面轉型電動車！400億歐元上膛,0,Mercedes -Best Target will be comprehensively transformed by 2030! Rice 40 billion euros
207,567,https://esg.businesstoday.com.tw/article/category/180687/post/202012170028,前三名竟然從缺！氣候變遷績效指標出爐：台灣吊車尾，卻贏美國、加拿大，未來關鍵減碳路徑是...,3,"The top three are missing! Climate change performance indicators are released: Taiwan cranes, but win the United States and Canada. The key carbon reduction path in the future is ..."
208,2128,https://esg.businesstoday.com.tw/article/category/180689/post/202209080027,惹惱加盟主！麥當勞續約新制上路，為何引來 9 成 5 業主不滿？連鎖餐飲的轉型挑戰,1,"Bad annoyed joining the Lord! McDonald's renewal of the new system on the road, why did it attract 95 % of the owners? Challenge of chain catering"
209,1410,https://esg.businesstoday.com.tw/article/category/180687/post/202112290049,減碳是門好生意！台灣企業零碳轉型，最缺這四類綠領人才,3,"Carbon reduction is a good business! Zero carbon transformation in Taiwan companies, the most lack of these four types of green collar talents"
210,2013,https://esg.businesstoday.com.tw/article/category/180688/post/202207270022,不以賺錢為主！減少食物浪費、愛護環境.. 家樂福「影響力永續概念店」建立了珍貴的通路新價值,0,"Do not focus on making money! Reduce food waste and care for the environment .. Carrefour's ""Influence Sustainable Concept Store"" has established precious new values ​​of channels"
211,362,https://esg.businesstoday.com.tw/article/category/180689/post/202009160045,企業個案》金屬加工機械廠千富企業　降低訂單集中風險  自創品牌成營收原動力,0,"Cases of Enterprise Cases ""Metal Processing Machinery Factory Qianfu Enterprise reduces order concentration risks and creates its own brand."
212,764,https://esg.businesstoday.com.tw/article/category/180689/post/202104140036,群創暖心催生記》男性職員帶薪「陪伴產檢假」、集中接送員工子女....照顧他們的心，比發錢更能留才,0,"""Qunchuang Heart Breeding Born"" Male employee brings paid ""accompany maternity leave"", concentrated pick -up and delivery of employees' children .... Taking care of their hearts, more than sending money"
213,2231,https://esg.businesstoday.com.tw/article/category/180689/post/202210170017,ESG大數據展現潛在風險，企業未雨綢繆實踐永續經營,0,ESG big data shows potential risks.
214,253,https://esg.businesstoday.com.tw/article/category/180687/post/202006030016,從建築找到全球暖化的新解方！以木頭造屋取代鋼筋水泥，每年可望吸收上億噸二氧化碳,3,"Find a new solution of global warming from architecture! The wooden house is replaced by the wooden house, which is expected to absorb hundreds of millions of tons of carbon dioxide each year"
215,78,https://esg.businesstoday.com.tw/article/category/180688/post/201810240011,當個環境改革者吧！,3,Be an environmental reformeer!
216,354,https://esg.businesstoday.com.tw/article/category/180687/post/202009110013,丹麥通過《氣候法案》，展現「綠色轉型」的決心！10年內減碳7成，還要課徵碳排稅,3,"Denmark shows the determination of ""green transformation"" through the ""Climate Act""! 70 % of carbon reduction within 10 years, and carbon taxes are required"
217,1478,https://esg.businesstoday.com.tw/article/category/180689/post/202201190015,鴻海、亞馬遜都相中它！成立一年空降為全球 no.4 車廠，Stellantis 是什麼來頭？,0,Hon Hai and Amazon are all in it! The one -year airborne is the global NO.4 car manufacturer. What is the head of Stellandis?
218,1549,https://esg.businesstoday.com.tw/article/category/180687/post/202202170008,科學減碳不科學？氣候組織轟SBTi淪企業漂綠平台！雀巢、IKEA遭點名,3,"Scientific carbon reduction is unscientific? Climate Organization Boom SBTI Disposal Drifting Platform! Nestlé, IKEA was named"
219,32,https://esg.businesstoday.com.tw/article/category/180688/post/201803090042,10年救千隻流浪狗，每年醫療費燒200萬...她說：看見你們撲向我，就是最幸福的事,3,"10 years to save thousands of stray dogs, and the medical expenses burned 2 million each year ... She said: Seeing you rushing to me is the happiest thing"
220,992,https://esg.businesstoday.com.tw/article/category/190807/post/202108180042,台灣大未來》不想被世界潮流淘汰？當ESG成為世界共同語言，你該問的不是「why」而是「why not」,3,"""Taiwan's Great Future"" does not want to be eliminated by the world trend? When ESG becomes a common language in the world, you should ask not to ask ""why"" but ""why not"""
221,754,https://esg.businesstoday.com.tw/article/category/180687/post/202104060022,台泥揭密藏身彰濱的MIT「虛擬電廠」，什麼來頭？再砸百億建超級電池工廠,0,"What is the head of the MIT ""virtual power plant"" hidden in Changbin, which is tightly hidden in Changbin? Small 100 billion yuan to build a super battery factory"
222,1226,https://esg.businesstoday.com.tw/article/category/180687/post/202111090008,空氣污染指數怎麼看？空污的影響遠比你想的大！這些都是空氣污染來源,3,What do you think of the air pollution index? The impact of air pollution is far greater than you think! These are the source of air pollution
223,1379,https://esg.businesstoday.com.tw/article/category/180689/post/202112220008,公司快破產，不落跑嗎？他選擇留下來，把客戶賠償金從5億殺到10萬元，從夥計變老闆！,0,"The company is about to go bankrupt and don't run away? He chose to stay, kill customer compensation from 500 million to 100,000 yuan, and changed from a boss!"
224,1537,https://esg.businesstoday.com.tw/article/category/180689/post/202202160020,目標2030 年轉型成全電動車公司！Volvo 重金打造巨型壓鑄機，專門生產新電動車,0,"Target 2030 transformed into a full electric vehicle company! VOLVO heavy money to create a giant die -casting machine, specializing in the production of new electric vehicles"
225,1403,https://esg.businesstoday.com.tw/article/category/180687/post/202112290041,富邦金攜手小智研發，把廢棄口罩變手機充電版！怎麼做到的？,0,"Fubon Jin joined hands with Xiaozhi to develop, charging the abandoned mask into the mobile phone! How to do it?"
226,378,https://esg.businesstoday.com.tw/article/category/180687/post/202009170034,環境教育、邁向永續！　潘文忠部長：整合跨部會之力，以行動倡議、落實環教跨域,3,"Environmental education, moving towards perpetual! Minister Pan Wenzhong: Integrate the power of the cross -ministerial meeting to act with action initiative and implement the cross -domain of environmental education"
227,642,https://esg.businesstoday.com.tw/article/category/180687/post/202101290036,2021年Top100全球最永續企業名單出爐！台積電名列20,3,The list of the world's most sustainable enterprises in TOP100 in 2021 is released! TSMC ranked 20
228,1578,https://esg.businesstoday.com.tw/article/category/180687/post/202203010003,水、旱災都會更加嚴重！全球暖化止不住，本世紀恐增2℃,3,"Water and drought will be more serious! Global warming can't stop, this century may increase by 2 ℃"
229,828,https://esg.businesstoday.com.tw/article/category/180687/post/202105240038,綠色金融撐離岸風電，離岸風電撐護國群山,3,"Green Finance supports offshore wind power, offshore wind power supports the country"
230,1740,https://esg.businesstoday.com.tw/article/category/190807/post/202204130020,植入ESG意識，從簡單綠行動開始,3,"Plant ESG consciousness, start with simple green operations"
231,747,https://esg.businesstoday.com.tw/article/category/180689/post/202103310010,大魔王來了！上市櫃公司小心，620兆資金正因「一條法規」調整持股,3,"The big devil is here! Be careful of listed cabinets, 620 trillion funds are adjusted by ""one regulation"" to adjust their holdings"
232,873,https://esg.businesstoday.com.tw/article/category/180687/post/202107010004,台灣溫管法修法需加速！徵碳稅可使2050臺灣GDP提升4％，為何遭財政部拒絕？,3,Taiwan's temperature management method must be accelerated! Carbon taxes can increase the 2050 Taiwan GDP 4 %. Why is it rejected by the Ministry of Finance?
233,2082,https://esg.businesstoday.com.tw/article/category/190807/post/202208230012,積極推動永續森林合作計畫！HP攜手林務局，播下2022棵樹苗,0,Actively promote the Sustainable Forest Cooperation Program! HP joined hands with the Forestry Bureau to broadcast 2022 saplings
234,450,https://esg.businesstoday.com.tw/article/category/180688/post/202010190022,別再說台灣是鬼島了！中韓台日「加班文化」比較：中國階級剝削最嚴重，南韓才是爆肝之國,3,"Don't say that Taiwan is a ghost island! Comparison of ""overtime culture"" in China, South Korea and Taiwan: Chinese class exploitation is the most serious, South Korea is the country of bursting liver"
235,1908,https://esg.businesstoday.com.tw/article/category/180689/post/202206170019,裕隆獲利創16年新高！新冠疫情、供應鏈缺料衝擊…嚴陳莉蓮如何逆勢交出好成績？,0,Yuron made a new high for 16 years! The new crown epidemic and supply chain lack of material impact ... How does Yan Chen Lilian make good results against the trend?
236,219,https://esg.businesstoday.com.tw/article/category/180687/post/202004080015,整改高齡焚化廠   解決不了垃圾危機,3,The rectification of the old -age incineration plant cannot solve the garbage crisis
237,1183,https://esg.businesstoday.com.tw/article/category/180688/post/202110270054,已羨慕！有健身房、駐廠醫生、幼兒園，連食物都「超強又比外面便宜」...聯發科找人才，邀工程師拍影片現身說法,0,"I have envious! There are gyms, doctors in the factory, and kindergarten, even the food is ""super strong and cheaper than the outside"" ... MediaTek finds talents, invite engineers to make a video to show up"
238,1455,https://esg.businesstoday.com.tw/article/category/180687/post/202201130036,衝上30％市占！電動機車銷量2021年起死回生，Gogoro做對了三件事,0,Rush to 30 %! The sales volume of electric motorcycles has returned from 2021. Gogoro has done three things right
239,739,https://esg.businesstoday.com.tw/article/category/180688/post/202103280003,健保給付制度，將出現2大變革...陳時中：改變規則就能幫健保省錢！,4,There will be two major changes in the health insurance payment system ... Chen Shizhong: Change the rules can help health insurance save money!
240,584,https://esg.businesstoday.com.tw/article/category/180687/post/202012240041,台灣真的要發展電動車？這場與八大機車商的會議，為何讓禁燃油車的政策轉彎,3,Taiwan really wants to develop electric vehicles? Why does this meeting with the eight major locomotive makers turn the policy of banning fuel vehicles?
241,1887,https://esg.businesstoday.com.tw/article/category/180687/post/202206060006,部署碳中和！台塑啟動百億元太陽能自建大投資,0,Deploy carbon neutrality! Formosa Plastics starts 10 billion yuan of solar self -built investment
242,389,https://esg.businesstoday.com.tw/article/category/180687/post/202009240009,蔡政府2025年綠電占2成目標可望達成？經濟部次長曾文生：相當有信心,3,"Is the Tsai government's 20 % target in 2025? Zeng Wensheng, the Secretary of the Ministry of Economic Affairs: quite confident"
243,2108,https://esg.businesstoday.com.tw/article/category/180687/post/202209010018,透過碳排放標籤，做更友善的選擇！這兩家B型企業，讓你吃冰淇淋、喝茶救地球,0,"Make more friendly choices through carbon emission labels! These two B -type companies allow you to eat ice cream, drink tea to save the earth"
244,834,https://esg.businesstoday.com.tw/article/category/180687/post/202105310032,發表首款環保永續筆電！宏碁承諾 2035 年實現採用 100％再生能源,0,Published the first environmental protection and sustainable laptop! Acer promised to use 100 % renewable energy in 2035
245,1971,https://esg.businesstoday.com.tw/article/category/180687/post/202207110017,資源再優化！日本企業利用AI縮減工地混凝土浪費，還有助減少CO2排放,0,"Resources optimize! Japanese companies use AI to reduce the waste of construction site concrete, which will help reduce CO2 emissions"
246,2010,https://esg.businesstoday.com.tw/article/category/180689/post/202207250050,牛仔褲大王如興陷重大危機！ 晚間發最新聲明：幾無可動支現金,1,Jeans king Ru Xing is in a major crisis! The latest statement was issued in the evening:
247,1649,https://esg.businesstoday.com.tw/article/category/180689/post/202203170004,Volvo、星巴克攜手合作，一杯咖啡時間完成EV充電,0,Volvo and Starbucks work together to complete EV charging a cup of coffee time
248,1030,https://esg.businesstoday.com.tw/article/category/180689/post/202109020004,半世紀來最耀眼的中鋼！翁朝棟曝「4大重點」揭開新時代，謝金河：象徵台灣的優質經營,0,"The most dazzling Sinosteel in the half century! Weng Chaodong exposed the ""4 major points"" to unveil the new era, Xie Jinhe: symbolizes Taiwan's high -quality operations"
249,674,https://esg.businesstoday.com.tw/article/category/180687/post/202102250024,焚化爐底渣摻水泥，合法回填彰化農地...立委痛批：農地不是棄置場,3,The bottom of the incineration furnace is mixed with cement and legally recovered in Changhua's agricultural land ... legislators criticized: farmland is not abandoned
250,460,https://esg.businesstoday.com.tw/article/category/180688/post/202010210025,神奈川靠「市民力」　登日本最強永續城市,3,"Kanagawa rely on ""citizenship"" to ascend Japan's strongest perpetual city"
251,1323,https://esg.businesstoday.com.tw/article/category/180688/post/202112020005,建構低碳、綠色混凝土！台泥建立「混凝土履歷制度」，成國內首家取得產品履歷證書的水泥廠,0,"Construct low -carbon, green concrete! The ""concrete resume system"" is established in Taid, which has become the first cement plant in China to obtain a product resume certificate"
252,331,https://esg.businesstoday.com.tw/article/category/180689/post/202008260017,上市櫃公司注意！「公司治理3.0」懶人包出爐，2021年將建置永續版,3,"Listed cabinet company pay attention! ""Company Governance 3.0"" lazy bag is released, and a permanent version will be built in 2021"
253,748,https://esg.businesstoday.com.tw/article/category/180688/post/202103310041,獨家專訪》連華爾街巨頭也關注這件事！為何黃天牧認為ESG三個字母中，台灣最缺「S」？,3,"Exclusive interview """" Even Wall Street giants also follow this! Why does Huang Tianmu think that among the three ESG letters, Taiwan is the most lacking ""S""?"
254,475,https://esg.businesstoday.com.tw/article/category/180688/post/202010270041,極端氣候下的商機與轉機：ESG幫投資人重新配置資本，迎向低碳經濟,3,Business opportunities and turns under extreme climate: ESG helps investors to configure capital to welcome the low -carbon economy
255,2140,https://esg.businesstoday.com.tw/article/category/180688/post/202209130014,股東停止分紅，將現金利潤全留給基層員工！疫情來襲，為何成真咖啡仍能維持破億營收？,0,"Shareholders stop dividends and leave all cash profits to grassroots employees! The epidemic strikes, why can Chengzhen coffee still maintain 100 million income?"
256,1077,https://esg.businesstoday.com.tw/article/category/180687/post/202109270006,專家說法》買電動車，真的就變環保了嗎？,3,"""Expert saying"" buy an electric car, is it really environmental protection?"
257,1707,https://esg.businesstoday.com.tw/article/category/180689/post/202204010003,凡事從消費者體驗和需求出發，老字號早餐店麥味登這樣做轉型,0,"Starting from consumer experience and demand, the old -fashioned breakfast shop Mai Weiden transformed this"
258,1799,https://esg.businesstoday.com.tw/article/category/180689/post/202204300004,台積電、聯電、信義房屋等上巿9強，連8年名列證交所「公司治理評鑑」5％前段班,0,"TSMC, UMC, and Xinyi Houses have listed in the top 9, and even 8 % of the ""Company Governance Evaluation"" of the Stock Exchange ""Company Governance Evaluation"" 5 % in the first class"
259,112,https://esg.businesstoday.com.tw/article/category/180688/post/201902140026,台灣每11天操死一名勞工，醫師：過勞死的人不能說話，活下來的要替他們發聲,3,"Every 11 days in Taiwan, a labor, a doctor: The person who is overworked can not speak."
260,604,https://esg.businesstoday.com.tw/article/category/180689/post/202101060064,防範銀行理專五鬼搬運，「這件事」是重點...美國聯準會給台灣的啟示,3,"Preventing the handling of five ghosts of the bank, ""this incident"" is the focus ... the US Fed"
261,1384,https://esg.businesstoday.com.tw/article/category/180687/post/202112220029,用過暖暖包不浪費！ 日本募資計畫，回收暖暖包淨化水質,0,"I have used warm bags and not wasted! Japan fundraising plan, recycling warm bag purification water quality"
262,1910,https://esg.businesstoday.com.tw/article/category/180687/post/202206170011,水泥業怎麼減碳？台泥近5年8成資本支出都投入進去，成功大減420萬噸碳排,0,"How to reduce carbon in the cement industry? In the past 5 years, 80 % of the capital expenditures have been invested in TSM, and successful decreased by 4.2 million tons of carbon row"
263,2361,https://esg.businesstoday.com.tw/article/category/180687/post/202211220014,COP27落幕》禁化石燃料落空、設立損失與損害基金成峰會最大進展,3,"COP27 Setting ""forbidden fossil fuel failure, establishment of losses and damage funds to the biggest progress of the summit"
264,1107,https://esg.businesstoday.com.tw/article/category/190807/post/202110050047,後疫情曙光看見ESG行動 康舒科技百位員工眷屬共好淨灘,0,The dawn of the post -epidemic seeing ESG Action Kangshu Technology Hundreds of employees' relatives in the same clean beach
265,1504,https://esg.businesstoday.com.tw/article/category/190807/post/202201260067,寶晶能源攜手佳龍科技，搶攻儲能市場,0,Baojing Energy joins hands with Jialong Technology to attack the energy storage market
266,379,https://esg.businesstoday.com.tw/article/category/180689/post/202009210022,4年拔4董座不手軟！金管會力推「公司治理」，一文解析：吳東進、趙藤雄...犯了什麼天條？,3,"Four years of the 4 directors are not soft! The financial management will push the ""corporate governance"", and the analysis of one article: Wu Dongjin, Zhao Tengxiong ... What kind of barrier?"
267,1702,https://esg.businesstoday.com.tw/article/category/180687/post/202203310004,畜牧業如何減碳？全球最大有機消費品牌「有機谷」靠飼養管理、再生能源達到碳中和,0,"How to reduce carbon in animal husbandry? The world's largest organic consumer brand ""Organic Valley"" rely on breeding management and renewable energy to achieve carbon neutralization"
268,257,https://esg.businesstoday.com.tw/article/category/180688/post/202006080028,不當百萬年薪科技男！從研發到生產都是MIT　他要靠「環保貓砂」拯救流浪貓,0,"Improper a million annual salary science and technology men! From research and development to production is mit, he wants to save stray cats by ""environmentally friendly cat sand"""
269,600,https://esg.businesstoday.com.tw/article/category/180688/post/202101040037,影響力投資：你投資的每一分錢如何改變世界？,3,Influence investment: How can you change the world every penny you invest?
