,pk,URL,news_headline,impact_type,translated
913,372,https://esg.businesstoday.com.tw/article/category/180687/post/202009160008,「永續發展 臺北市2020自願檢視報告」出爐 因應後疫情時代　接軌國際　邁向宜居永續城市,3,"""Sustainable Development of Taipei 2020 Volunteer Review Report"" is released in response to the post -epidemic era."
914,2045,https://esg.businesstoday.com.tw/article/category/180689/post/202208090021,用30分鐘就證明蛋糕上的小黑點是香草籽！新光三越把關食安，與廠商一起做ESG,0,"Use 30 minutes to prove that the little black dot on the cake is vanilla seeds! Shin Kong Sanyue puts off the food and food, and do ESG with the manufacturer"
915,1051,https://esg.businesstoday.com.tw/article/category/180689/post/202109150037,深度專訪》亞洲權威公司治理機構首席專家Neesha Wolf：公司治理沒有「標準答案」 台灣需要改變的，是「文化」！,3,"In -depth interview """" Neesha Wolf, chief expert of the Asian authoritative company governance agency: Company governance does not have ""standard answers"" in Taiwan to change, it is ""culture""!"
916,1874,https://esg.businesstoday.com.tw/article/category/180689/post/202206010040,「廁所旁開店，生意好到爆！」30年老牌手搖飲歇腳亭翻身台灣珍奶新股王，揭密「日銷900杯展店術」,0,"""Open the shop next to the toilet, the business is so explosive!"" The 30 -year -old old hand shakes and rests the king of Taiwan Zhen milk, revealing ""900 cups daily cup show shop"""
917,2372,https://esg.businesstoday.com.tw/article/category/180687/post/202211240006,艾瑪絲用回收牛奶瓶製成容器、取得循環經濟認證.. 要美麗也要永續！美科實業如何成為「對世界最好」的企業？,0,"Emart uses recycling milk bottle to make containers and obtain circular economy certification .. Beauty must be permanent! How does Meike Industry become the ""best to the world"" company?"
918,83,https://esg.businesstoday.com.tw/article/category/180689/post/201810310041,擺脫代工宿命...台達電蔡榮騰：綠能研發技術將根留台灣,0,Get rid of the destiny of foundry ... Taida Electric Cai Rongteng: Green Energy R & D technology will leave Taiwan
919,79,https://esg.businesstoday.com.tw/article/category/180687/post/201810240009,對抗暖化  別耗盡化石能源,3,"Based on warmth, exhaustion of fossil energy"
920,2324,https://esg.businesstoday.com.tw/article/category/180689/post/202211120004,10萬人被炒！矽谷「最大規模人事縮減」⋯Meta、推特勒緊腰帶，盤點8家科技巨頭裁員風暴,1,"100,000 people were fired! Silicon Valley's ""largest personnel reduction"" ⋯ meta, Twitter tightened the belt, inventory 8 technology giants lay off storms"
921,2463,https://esg.businesstoday.com.tw/article/category/180689/post/202212290011,如何推動永續？現代管理學之父最常問企業這三個問題,3,How to promote permanent? The father of modern management most often asks the three questions of the enterprise
922,996,https://esg.businesstoday.com.tw/article/category/190807/post/202108180034,台灣大未來》「永續是沒有終點線的競賽」，金管會主委黃天牧：全球嚴肅面對4大議題,3,"Taiwan's ""Future"" ""Sustainable is a competition without the end line"", Huang Tianmu, chairman of the HKMA: Facing 4 major issues worldwide seriously"
923,62,https://esg.businesstoday.com.tw/article/category/180687/post/201809050017,最髒海域泡沫垃圾綿延1公里,3,The dirtiest sea bubble garbage stretches for 1 km
924,346,https://esg.businesstoday.com.tw/article/category/180689/post/202009090056,台積電擴大徵才》高壓、工時長，離職率卻僅業界1/3...業內人士點出台積電「選才」關鍵,0,"""TSMC expands its talents"" high -voltage and long work hours, but the leaving rate is only 1/3 of the industry ... Industry insiders point out that the key ""selection"" is the key"
925,651,https://esg.businesstoday.com.tw/article/category/180687/post/202102040027,揭發史上最嚴重的戴奧辛汙染事件！無良企業最恨他，「鬼阿伯」不甩威脅堅守台灣25年！,3,"Demonstrate the worst Dalobin pollution incident in history! Unscrupulous companies hate him the most, ""Ghost Aber"" does not threaten to stick to Taiwan for 25 years!"
926,1907,https://esg.businesstoday.com.tw/article/category/190807/post/202206160013,台塑股東會遭指國際ESG劣等生！「環保小股東」年年揭環境與人權危害,1,"Formosa shareholders will be pointed out that international ESG is inferior! ""Small environmental protection shareholders"" expose environmental and human rights hazards every year"
927,1018,https://esg.businesstoday.com.tw/article/category/190807/post/202108260004,全球發電設施碳排量反彈至歷史新高！專家：能源轉型極為緩慢，人類恐怕難逃氣候變遷最糟衝擊,3,"Global power generation facilities have rebounded to a record high! Experts: Energy transformation is extremely slow, and human beings may not escape the worst impact of climate change"
928,419,https://esg.businesstoday.com.tw/article/category/180687/post/202010060037,森崴總經理胡惠森：台灣再生能源人才不缺，缺的是經驗　期許政府放眼世界一起走長走遠,0,"Hu Huisen, general manager of Mori: Taiwan's renewable energy talents are not lacking. What is lacking is that experience hopes that the government will look at the world together"
929,136,https://esg.businesstoday.com.tw/article/category/180689/post/201907100016,社會企業撥亂反正的玄機,0,Social enterprises to disordinate the mystery anyway
930,159,https://esg.businesstoday.com.tw/article/category/180687/post/201910080011,「台灣是我的家，我必須保護它」　千萬律師棄美籍成台灣環保鬥士,3,"""Taiwan is my home, I have to protect it,"" millions of lawyers abandon American bids into Taiwan environmental protection fighters"
931,2438,https://esg.businesstoday.com.tw/article/category/180688/post/202212200018,董座說真話：全家投入永續，一開始只是想減少虧損... 便利商店催生出「友善食光」，背後有這些盤算,0,"Dong Zone tells the truth: The family is in a sustainable, and at the beginning, I just want to reduce losses ... Convenience stores have spawned ""friendly food"", there are these calculations behind"
932,37,https://esg.businesstoday.com.tw/article/category/180688/post/201804020007,恐懼與不恐懼,4,Fear and not fear
933,1369,https://esg.businesstoday.com.tw/article/category/180687/post/202112160028,綠電短缺碰上核四公投，太陽能大佬：台灣綠能有技術、應專注打造非核家園,3,"Green power shortage encountered the four nuclear referendum, solar gangster: Taiwan green energy has technology, and should focus on building non -nuclear homes"
934,819,https://esg.businesstoday.com.tw/article/category/180687/post/202105180032,513大停電的啟示：台灣缺水又缺電...兩大主因讓台灣淪排碳大戶,3,513 Revelation of the power outage: Taiwan is short of water and lacks electricity ... The two main causes allow Taiwan to reduce Taiwan's large carbon households
935,629,https://esg.businesstoday.com.tw/article/category/180688/post/202101220038,達賴喇嘛與環保少女童貝里對談：氣候變遷的警鐘，敲醒下一輪的暖化亂世,3,"The Dalai Lama talks to the environmentally friendly girl Belry: The alarm of climate change, wake up the next round of warming troubled times"
936,406,https://esg.businesstoday.com.tw/article/category/180687/post/202009290044,假日淨灘拾起2400公斤垃圾！這群印尼移工給台灣人的一堂課：不要想這是誰的垃圾，要想這是誰的地球,3,"Pick up 2400 kilograms of garbage on holidays! This group of Indonesian migration to Taiwanese lesson: Don't think about who this is the garbage, who is the earth?"
937,1424,https://esg.businesstoday.com.tw/article/category/180688/post/202201050043,五年業績成長四倍、員工離職率零！企業吸引優質客戶的秘密：先圈粉員工,0,"Five years of performance growth, zero employee departure rate! The secret of the company attracts high -quality customers: first circle fan employees"
938,411,https://esg.businesstoday.com.tw/article/category/180687/post/202009300037,三菱重工、西門子能源都是合作夥伴！丹麥新研究中心將大力發展零二氧化碳航運,3,Mitsubishi Heavy Industry and Siemens Energy are all partners! The Denmark New Research Center will vigorously develop zero carbon dioxide shipping
939,120,https://esg.businesstoday.com.tw/article/category/180687/post/201903270021,地方創生  重要的是能留下什麼,3,What is important for local creation is what to leave
940,1001,https://esg.businesstoday.com.tw/article/category/180687/post/202108190016,乾旱緊接著豪雨成災，臺灣如何因應氣候新常態？,3,The drought was followed by heavy rain. How can Taiwan respond to the new normal of the climate?
941,355,https://esg.businesstoday.com.tw/article/category/180687/post/202009120004,「2020臺北永續未來願景論壇」發表能源政策、循環城市白皮書 柯文哲:勇敢面對永續發展挑戰 創造無限可能,3,"""2020 Taipei Sustainable Future Vision Forum"" published an energy policy, circular city white paper Ke Wenzhe: brave facing sustainable development challenges to create unlimited possibilities"
942,449,https://esg.businesstoday.com.tw/article/category/180687/post/202010160009,品牌力就是好獲利！在柬埔寨設廠，雇用培訓被剝削與家暴婦女，讓這家牛仔褲品牌庫存被清空,0,"Brand power is good profit! To set up factories in Cambodia, hiring training is exploited and domestic violence women, so that this jeans brand inventory is empty"
943,1730,https://esg.businesstoday.com.tw/article/category/180689/post/202204110017,當年郭董追四年娶到日本百年企業，如今鴻海要以速度取勝，從日本車廠手上吃下電動車新市場？,0,"At that time, Guo Dongzun married a century -old Japanese company in four years. Now Hon Hai will win at a speed and eat a new market for electric vehicles from the Japanese car manufacturer?"
944,1547,https://esg.businesstoday.com.tw/article/category/180687/post/202202170009,碳排也貧富不均！英國研究：減少富人碳足跡是淨零最快解法,3,Carbon rows are also uneven in the rich and poor! British research: reducing the carbon footprint of the rich is the fastest solution of the net zero
945,1427,https://esg.businesstoday.com.tw/article/category/180689/post/202201050027,TOYOTA開發電動車30年，為何現在才加入戰局？ 豐田章男從「反對派代表」到「電動車大魔王」雄心解讀,0,"TOYOTA has developed an electric vehicle for 30 years, why has it joined the battle now? Toyota Zhangnan ambitious interpretation from ""opposition representative"" to ""electric vehicle devil"""
946,1491,https://esg.businesstoday.com.tw/article/category/180687/post/202201220026,靠吸管救地球也救農村！玩艸植造如何翻轉大家對一次性吸管的想像？,0,Save the earth by straws and save the countryside! How do I flip the imagination of the disposable straws?
947,613,https://esg.businesstoday.com.tw/article/category/180687/post/202101120026,鈷是製造電動車電池的必備元素，6成來自剛果...付出的代價是：血汗童工、有毒河流,3,"Cobalt is an essential element for manufacturing electric vehicle batteries. 60 % come from the Congo ... The price paid is: sweat -sweaty children's workers, toxic rivers"
948,1743,https://esg.businesstoday.com.tw/article/category/180689/post/202204130077,時隔6年，張國煒再入長榮綠色大門！就在星宇累虧逾60億的現在，他接立榮董座背後原因是？,2,"After 6 years, Zhang Guowei entered the Green Gate of Changrong! Now that Xingyu has a loss of more than 6 billion now, the reason is behind the seat of the Chief of Rong?"
949,464,https://esg.businesstoday.com.tw/article/category/180687/post/202010210018,六大重金屬空汙費率，應加重！為何環保署還有理由調降空汙費？,3,Six heavy metal air pollution rates should be aggravated! Why do the Environmental Protection Agency still have reasons to reduce air pollution fees?
950,458,https://esg.businesstoday.com.tw/article/category/180689/post/202010210026,新冠肺炎疫情重創全球航空業，華航如何單季賺24億元？,0,The new coronary pneumonia's epidemic creates the global aviation industry. How can China Airlines earn 2.4 billion yuan in a quarter?
951,988,https://esg.businesstoday.com.tw/article/category/180687/post/202108170005,特斯拉談電池回收，廢電池入土比例是 0%,0,Tesla talks about battery recycling. The proportion of waste batteries is 0%
952,1483,https://esg.businesstoday.com.tw/article/category/180689/post/202201200006,無油可加、超市大缺貨....大缺工時代來臨，企業如何留人又留心？,3,"No oil can be added, supermarkets are out of stock .... In the era of lack of work, how can companies keep people pay attention?"
953,2240,https://esg.businesstoday.com.tw/article/category/190807/post/202210180019,郭董開最新電動休旅車Model B亮相　加速至100公里僅六秒！ 鴻海今發表三款EV　將在台灣、泰國、美國生產,0,"Guo Dongkai's latest electric recreational vehicle Model B has accelerated to 100 kilometers only six seconds! Hon Hai today published three EVs in Taiwan, Thailand, and the United States"
954,1239,https://esg.businesstoday.com.tw/article/category/190807/post/202111110020,開箱鴻海版元宇宙！能跟郭台銘、劉揚偉自拍，還能搶先搭電動巴士,0,"Open the box Hon Hai version of the Yuan universe! Being able to take a selfie with Guo Taiming and Liu Yangwei, you can also take the electric buses first"
955,1119,https://esg.businesstoday.com.tw/article/category/190807/post/202110100009,油價再創新高，背後最大原因是它！陶冬：一場全球性能源危機似乎正在開啟,3,The biggest reason behind it is the biggest reason for oil prices! Tao Dong: A global performance crisis seems to be opening
956,1495,https://esg.businesstoday.com.tw/article/category/180688/post/202201240021,家樂福咖啡品牌inLove Café亮相！起步晚的它如何在超商超市一片紅海中脫穎而出？,0,Carrefour coffee brand Inlove Café appeared! How can it stand out in the red sea in the supermarket?
957,1506,https://esg.businesstoday.com.tw/article/category/180687/post/202201270002,蠶絲不只能做衣服！還能作為食物保鮮的食用塗層，減少食物浪費,3,Silk not only make clothes! It can also be used as a food coating for food preservation to reduce food waste
958,476,https://esg.businesstoday.com.tw/article/category/180689/post/202010280025,先瘦身再養壯　茂迪深蹲兩年重返獲利,0,"Slimming first, then supporting Mao Di, squatting for two years and returning to profit for two years"
959,534,https://esg.businesstoday.com.tw/article/category/180687/post/202012020006,氣溫驟降！電暖器購買指南：燈管、葉片、陶瓷...5大電暖器怎麼挑？這一種最耗電,3,"The temperature drops suddenly! Purchase purchase guide: lamp tube, blades, ceramics ... how to pick 5 major electric heaters? This is the most power -consuming"
960,1550,https://esg.businesstoday.com.tw/article/category/180688/post/202202170006,50年前就設立專屬托兒所讓員工安心工作，還可彈性上下班！外送平台、訂閱制的始祖：養樂多媽媽,0,"Fifty years ago, the employees were settled by exclusive nursery to work with peace of mind, and it was flexible to get off work! The ancestor of the delivery platform and subscription system: Yangle Duo mother"
961,666,https://esg.businesstoday.com.tw/article/category/180687/post/202102220031,電動車不排碳？電池製造比較環保？一篇解析：為何台灣人需要更關心電動車,3,Does electric vehicle not carbon? Battery manufacturing is more environmentally friendly? Analysis: Why do Taiwanese need to care more about electric vehicles
962,1597,https://esg.businesstoday.com.tw/article/category/180689/post/202203070026,單靠賣奶賺不了錢！拆解鮮乳坊品牌塑造成功術,0,Can't make money by selling milk alone! Disassembling the brand of fresh dairy workshop
963,961,https://esg.businesstoday.com.tw/article/category/180688/post/202108030036,普惠金融，讓大眾都能享受良好的金融服務,3,Inclusive finance allows the public to enjoy good financial services
964,82,https://esg.businesstoday.com.tw/article/category/180688/post/201810300005,「教訓不檢點的女性！」惡整約炮女生事件，暴露台灣性別平等教育危機,4,"""Women who do not check the lessons!"" The crisis of the girl in the end of the artillery exposed the crisis of gender equality education in Taiwan"
965,1945,https://esg.businesstoday.com.tw/article/category/180687/post/202206300027,2022通路減塑評比，綠色和平點名全聯退步最多,3,"2022 Passing plastic reduction evaluation, green and peaceful names have the most retreat to the whole United States"
966,2284,https://esg.businesstoday.com.tw/article/category/180689/post/202211020017,不賣底片改做電動車電池！從大裁員到急徵上百個職位，柯達怎麼做到的？,0,Do not sell a film and change to electric vehicle batteries! How did Kodak do from the layoffs to hundreds of positions?
967,728,https://esg.businesstoday.com.tw/article/category/180687/post/202103230033,「供應鏈綠化」對台灣企業攸關生死！台達電做了哪些事，成為台灣最永續的公司？,0,"""Supply Chain Greening"" is related to Taiwanese enterprises! What did Dadian do to become Taiwan's most sustainable company?"
968,979,https://esg.businesstoday.com.tw/article/category/180689/post/202108110028,森崴能源申請上市通過！從太陽能、離岸風電跨到綠電販售，如何建造新能源王國？,0,"Mori Energy Application is listed! From solar and offshore wind power to green power sales, how to build a new energy kingdom?"
969,439,https://esg.businesstoday.com.tw/article/category/180687/post/202010140070,侯友宜：「SDGs是我最大施政目標」　六都永續發展　新北拿下三冠王,3,"Hou Youyi: ""SDGS is my biggest governance goal"" Liudu has developed sustainable development in New Taipei to win the three crowns"
970,1284,https://esg.businesstoday.com.tw/article/category/180689/post/202111240054,光陽明年拚「機車銷售23連霸、電動機車市占二哥」！董座柯勝峯布局公開,0,"Guangyang will fight for ""23 -Lianba in locomotive sales and the second brother in the electric motor vehicle market!"" Dongzhi Ke Shengfeng's layout is open"
971,1472,https://esg.businesstoday.com.tw/article/category/180687/post/202201190022,「成為對世界最好的企業」！三大面向減少美妝碳足跡，艾瑪絲如何實現綠色行動力？,0,"""Become the best company to the world""! The three major facing the carbon footprint of beauty, how does Emart achieve green action?"
972,1402,https://esg.businesstoday.com.tw/article/category/180687/post/202112290015,碳費還要等！收多少、怎麼用？ 環署擬另外公告「保留彈性」,3,"Carbon costs have to wait! How much do you use? The EIA intendes to announce another ""retaining elasticity"""
973,2051,https://esg.businesstoday.com.tw/article/category/180688/post/202208100027,「台灣地王」林堉璘生前捐贈303億，為何7年只花12億？兒子親上火線：做公益沒這麼簡單,3,"""The King of Taiwan"" Lin Yan donated 30.3 billion before his lifetime. Why spent 1.2 billion in 7 years? Son kissed the fire line: It is not so simple to do public welfare"
974,838,https://esg.businesstoday.com.tw/article/category/180689/post/202106020044,艱難時刻考驗信賴關係！崇越董座：疫情還會持續一段時間，我們該思考的事,3,"Test trust at all times! Chongyue Dong seat: The epidemic will last for a while, what we should think about"
975,768,https://esg.businesstoday.com.tw/article/category/180687/post/202104150005,當全台面臨缺水危機...唯獨「這縣市」沒水庫，卻罕見40年沒限水，它怎麼辦到的？,3,"When the whole Taiwan is facing a crisis of water shortage ... Only the ""county and city"" has no reservoir, but it is rare for 40 years without water limit. How can it do it?"
976,1006,https://esg.businesstoday.com.tw/article/category/190807/post/202108240042,臺灣港務港勤股份有限公司「新造離岸風電人員運維船」舉辦下水典禮,4,"Taiwan Port Port Line Co., Ltd. ""New offshore wind power personnel transportation ship"" holds a watering ceremony"
977,1048,https://esg.businesstoday.com.tw/article/category/180687/post/202109140001,廢氣回收再利用的典範！中油石化部砸11億減碳,0,The model of exhaust gas recovery and reuse! CNPC Petrochemical Department smashed 1.1 billion carbon reduction
978,1326,https://esg.businesstoday.com.tw/article/category/180687/post/202112030017,公民覺醒成永續核心 World Cleanup Day號召世界公民打掃全世界,3,Citizen Awakening becomes a sustainable core World Cleanup Day call for world citizens to clean the world
979,1844,https://esg.businesstoday.com.tw/article/category/180689/post/202205190005,勞動條件惡劣、自駕傷亡事故...特斯拉被踢出ESG指數！馬斯克嗆：ESG是騙局,1,"His labor conditions, self -driving casualties ... Tesla was kicked out of the ESG index! Musk: ESG is a scam"
980,1912,https://esg.businesstoday.com.tw/article/category/180689/post/202206200025,台灣將出現第２家營收百億元製藥廠！買下伊甸生醫後，保瑞再砸60億元收購安成藥，誰是最大贏家？,0,"There will be the second pharmaceutical factory in Taiwan! After buying Eden Biomedical, Bao Rui smashed another 6 billion yuan to buy Antario. Who is the biggest winner?"
981,859,https://esg.businesstoday.com.tw/article/category/180687/post/202106180021,促進零碳排　富邦金深化綠色金融影響力,0,Promote zero carbon row Fubon gold to deepen green financial influence
982,412,https://esg.businesstoday.com.tw/article/category/180687/post/202010050027,「投入再生能源市場，我們別無選擇！」全球4大能源交易商都加碼的2種投資,3,"""Invest in the renewal energy market, we have no choice!"" The two major energy dealers in the world increased the two types of investment"
983,2251,https://esg.businesstoday.com.tw/article/category/180689/post/202210210042,40年老廠淡出手機轉入特斯拉、警用相機供應鏈，致伸抱緊「中實型客戶」獲利反創新高,0,"At the age of 40, the old factory faded out of the mobile phone and turned into Tesla and the police camera supply chain, so that the ""medium -sized customer"" profit -making high -innovation high"
984,1275,https://esg.businesstoday.com.tw/article/category/180687/post/202111190008,一年總碳排僅12噸！這個小家庭如何過低工時、低開銷、低碳排的生活？,3,"The total carbon row of a year is only 12 tons! How does this small family have a low -cost time, low -cost, and low -carbon row?"
985,1831,https://esg.businesstoday.com.tw/article/category/180688/post/202205130024,不把四大超、連鎖咖啡視為對手！中油跨足咖啡戰場，背後原因竟是 ESG 轉型？,0,"Do not see the four super super superior and chain coffee as your opponent! CNPC across the coffee battlefield, the reason behind is the ESG transformation?"
986,2096,https://esg.businesstoday.com.tw/article/category/180688/post/202208260009,奉茶、淨灘、捐閒置好物…永豐百萬綠行動獲廣大迴響，每4度光電發電就有1度由永豐提供融資,0,"Fengcha, clean beach, and donated idle things ... Yongfeng millions of green actions have been echoed, and the power generation of photoelectric is provided by Yongfeng every 4 degrees of electricity."
987,1744,https://esg.businesstoday.com.tw/article/category/180687/post/202204150027,廢牡蠣殼、蛋殼只能堆成垃圾山？這技術讓它們變拖鞋、鈣片原料，連海底撈懶人火鍋都用得上！,3,"Can the oyster shell and egg shells only pile into garbage mountains? This technology makes them become slippers and calcium slices, and even sea lazy hot pot is used!"
988,791,https://esg.businesstoday.com.tw/article/category/180687/post/202104260019,車諾比35周年》環保聯盟再籲「廢核」：以人民力量為核四送終,3,"The 35th Anniversary of Chenby ""Environmental Protection Alliance called for"" abolition of nuclear "": the end of the four of the people's power"
989,97,https://esg.businesstoday.com.tw/article/category/180689/post/201811280050,中華汽車工業股份有限公司楊梅廠　節能減碳是長期任務，要越做越好才行,0,"China Automotive Industry Co., Ltd. Yangmei Factory Energy -saving and carbon reduction is a long -term task."
990,1835,https://esg.businesstoday.com.tw/article/category/180687/post/202205170015,伏特加、乾洗手、香水有什麼共同點？他們竟然都能緩和「溫室效應」！,0,"What are the things in common in vodka, dry hand washing, perfume? They can alleviate the ""greenhouse effect""!"
991,694,https://esg.businesstoday.com.tw/article/category/180687/post/202103050012,解決台灣偏鄉教師荒！TFT創辦人劉安婷：「讓不滿現狀的所有人，都有改變的動機」,0,"Solve the desert of Taiwan's hometown! TFT founder Liu Anting: ""Everyone who is dissatisfied with the status quo has the motivation to change"" """
